web-scraper-order,web-scraper-start-url,link,link-href,title,text,media,word_count
"1585370117-726","https://search-proquest-com.proxygw.wrlc.org/results/F74DC863F010412CPQ/1?accountid=11243","Full text","https://search-proquest-com.proxygw.wrlc.org/docview/2331790945/fulltext/F74DC863F010412CPQ/35?accountid=11243","Trump's Campaign War Chest Tops $100 Million Heading Into Election Year; President's re-election campaign raises $46 million in the final three months of 2019","Hide highlightingFull TextTranslateUndo Translation FromToTranslateTranslation in progress... 

[[missing key: loadingAnimation]]The full text may take 40-120 seconds to translate; larger documents may take longer.

Cancel
OverlayEndTurn on search term navigationTurn on search term navigation
| Jump to first hit
WASHINGTON—President Trump's re-election campaign said Thursday that its war chest stood at more than $100 million headed into the 2020 election year, after raising $46 million in the final three months of 2019.
Mr. Trump faces no significant Republican challenger, putting him at a campaign finance advantage over the many Democrats vying for their party's nomination in a highly competitive and costly primary. Although Mr. Trump is expected to have raised more than any single Democrat last quarter, together those candidates will at least double his haul but are expected to have much less cash on hand.
SHARE YOUR THOUGHTS
Where do you expect President Trump's campaign to focus its resources? Where would you like to see them allocated? Join the conversation below.
Trump campaign manager Brad Parscale said that this was the president's biggest fundraising quarter during the 2020 campaign cycle, calling him ""an unstoppable juggernaut."" Over the full year, the president's campaign raised a total of $143 million and had $102.7 million in the bank at the end of 2019.
Presidential campaigns must report fourth-quarter fundraising information to the Federal Election Commission by Jan. 31. Mr. Trump's fundraising tops the numbers that have been announced by Democratic presidential hopefuls.
Sen. Bernie Sanders, of Vermont,
brought in $34.5 million
in the final quarter of the year, according to his campaign, and former South Bend, Ind., Mayor Pete Buttigieg said he
raised $24.7 million
. Former Vice President Joe Biden said his campaign raised $22.7 million. None of the candidates released updated cash on hand numbers. Some candidates haven't released any numbers yet.
The president also works closely with the Republican National Committee to raise money, and the figures reported by the Trump campaign don't include the RNC's latest finances.
Mr. Trump gave himself an advantage by kicking off his re-election the day he was inaugurated. While recent presidents typically have waited until their third year in office to return to the campaign trail, Mr. Trump
immediately arranged to fundraise
for re-election and never stopped holding the large political rallies that helped him win office in 2016.
Sitting presidents almost always enjoy strong fundraising for re-election. Former President Barack Obama raised about $40 million in the fourth quarter of 2011, and former President George W. Bush raised $47.5 million in the fourth quarter of 2003, according to Federal Election Commission reports. Mr. Bush's campaign had almost $100 million in available cash at the start of his re-election year, the FEC reports show.
An advantage of incumbency is that Mr. Trump has been able to solicit maximum $360,600 donations from individuals, circumventing the far lower $2,800-per-donor cap now in place for the Democratic hopefuls. Those large checks are spread among Mr. Trump's fundraising partners, the RNC and state-level Republican parties. The eventual Democratic nominee also will be able to create a bigger-ticket fundraising program, but Mr. Trump has been benefiting from his arrangement for almost three years already.
Write to Julie Bykowicz at
julie.bykowicz@wsj.com
and Catherine Lucey at
catherine.lucey@wsj.com

Credit: By Julie Bykowicz and Catherine Lucey Word count: 506Show lessYou have requested ""on-the-fly"" machine translation of selected content from our databases. This functionality is provided solely for your convenience and is in no way intended to replace human translation. Show full disclaimerNeither ProQuest nor its licensors make any representations or warranties with respect to the translations. The translations are automatically generated ""AS IS"" and ""AS AVAILABLE"" and are not retained in our systems. PROQUEST AND ITS LICENSORS SPECIFICALLY DISCLAIM ANY AND ALL EXPRESS OR IMPLIED WARRANTIES, INCLUDING WITHOUT LIMITATION, ANY WARRANTIES FOR AVAILABILITY, ACCURACY, TIMELINESS, COMPLETENESS, NON-INFRINGMENT, MERCHANTABILITY OR FITNESS FOR A PARTICULAR PURPOSE. Your use of the translations is subject to all use restrictions contained in your Electronic Products License Agreement and by using the translation functionality you agree to forgo any and all claims against ProQuest or its licensors for your use of the translation functionality and any output derived there from. Hide full disclaimer

Longer documents can take a while to translate. Rather than keep you waiting, we have only translated the first few paragraphs. Click the button below if you want to translate the rest of the document.
Translate AllCopyright 2020 Dow Jones & Company, Inc. All Rights Reserved.","Wall Street Journal (Online)","506"
"1585369202-669","https://search-proquest-com.proxygw.wrlc.org/results/F74DC863F010412CPQ/1?accountid=11243","Full text","https://search-proquest-com.proxygw.wrlc.org/docview/2378725152/fulltext/F74DC863F010412CPQ/92?accountid=11243","Trump Re-Election Strategy Shifts Focus to Crisis Leadership; A 2020 campaign message built for a roaring economy is now being retooled to cope with coronavirus and sliding markets","Hide highlightingFull TextTranslateUndo Translation FromToTranslateTranslation in progress... 

[[missing key: loadingAnimation]]The full text may take 40-120 seconds to translate; larger documents may take longer.

Cancel
OverlayEndTurn on search term navigationTurn on search term navigation
| Jump to first hit
WASHINGTON—The
coronavirus crisis
is rapidly changing President Trump's re-election strategy, forcing him into the position of leading the nation through a sprawling, complex emergency while undermining his greatest asset: a strong economy.
Mr. Trump this week has taken steps to demonstrate more command, appearing at daily news conferences and taking a solemn outlook, while his campaign weighs how to contend with battered financial markets and rising unemployment.
""People are going to judge him in this moment—and this moment is going to last for a while,"" said Mike DuHaime, a Republican strategist not involved in the campaign. ""In the beginning he downplayed it too much and that hurt his credibility, but there is a lot of time to go now where he can compensate.""
That is forefront in the thinking of Mr. Trump's campaign advisers. The virus may ease amid extraordinary steps affecting all aspects of everyday life, and the campaign could resume its normal rhythms before Election Day. The situation, though, just as well as could worsen.
Mr. Trump's campaign is banking on the economy bouncing back ahead of the crucial several months before November when voters are paying the most attention, advisers say. It has begun to formulate an argument that Mr. Trump's policies since taking office fueled the economy to new heights, and that he is best equipped to build it up a second time if necessary.
""We will point out that it is under the present policies that it was so vibrant and those policies are still in place,"" campaign spokesman Tim Murtaugh said. ""The stock market will rebound, and the economy will still be in solid shape.""
This week the main super PAC supporting Mr. Trump's re-election held discussions on possible ads highlighting steps the president has taken to combat the virus, including putting travel restrictions on China, according to a person familiar with the talks.
In recent days Mr. Trump has referred to the ""Chinese virus,"" a term that has been criticized for its racist connotations. His campaign on Wednesday moved to portray him as taking tough actions against a world rival and sought to draw a contrast with Democratic presidential candidate Joe Biden, who is closing in on the Democratic presidential nomination.
The former vice president's campaign observed that the president has praised Chinese President Xi Jinping for his handling of the emergency. Of the Trump campaign's email, which accused Mr. Biden of ""incompetence and misinformation,"" Biden spokesman TJ Ducklo said, ""This is projection, pure and simple—a classic Trump campaign move.""
For now, campaign mechanics—including the rallies that energize Mr. Trump as much as his supporters—are in the background or on hold and the burden largely rests on the president using the White House stage to make his case. His discipline at news conferences this week has pleased advisers, though they privately acknowledge anything can change.
""I think the base will hold with him no matter, but if he does dumb stuff, he won't be able to build on his reach to voters,"" said one adviser.
""Americans typically rally around their president in times of national crisis, and this should be to Donald Trump's benefit,"" said Jeff Horwitt, a Democratic pollster who partners with Republicans on surveys for The Wall Street Journal. ""But Donald Trump is not a typical president. While he has a chance to seize the moment, unite the country and provide presidential leadership, over the past three years he has yet to prove that he is capable of doing so.""
Only a short time ago Mr. Trump was feeling especially confident. He emerged from the investigation into Russian interference in the 2016 election and then withstood impeachment. His campaign was running smoothly.
Now those gains are in jeopardy. A Gallup poll released Tuesday showed Mr. Trump's
approval rating was down to 44%
, slipping 5 percentage points and back to pre-impeachment levels. Among independent voters, his approval was down 7 percentage points.
""There is no question that Covid-19 and Trump's disastrous response will be a part of the political conversation for the rest of this campaign,"" said Josh Schwerin, spokesman for Priorities USA, the leading Democratic super PAC that has put its support behind Mr. Biden. Another outside group, Pacronym, said it was prepared to spend up to $5 million on coronavirus ads, and some already on Facebook criticize the administration's slowness to get testing kits to states.
The Trump campaign's tone has changed in the past week, but not its intensity. It has shifted to online training of volunteers who will be crucial to driving out voters and is considering online events featuring surrogates.
The campaign continues to seek donations from supporters daily, through emails, text messages and on social media. The pitches, however, are being modified to match the unity that White House officials are asking of Americans. Campaign officials expect to pause, at least temporarily, the ""fake news"" attacks and its most biting criticism of Democrats, which also tend to bring in the most money. (Mr. Trump himself, however, hasn't stopped leveling such attacks on Twitter.)
An email Wednesday asked surrogates to focus on what the campaign and the White House describe as unprecedented actions taken by the president. One talking point suggests focusing on the power that states now have to authorize laboratories to develop their own coronavirus tests, but doesn't acknowledge that was a response to the dire shortage of tests for the fast-moving virus.
As the crisis was first unfolding, Mr. Trump played it down, suggesting Democrats and the media were hyping the situation. He compared coronavirus to the seasonal flu, and said in January ""we have it totally under control."" Mr. Trump's tone has shifted in recent days. But when asked last week about the virus, only 33% of Mr. Trump's strongest supporters said they believed the worst was yet to come with the virus, compared with 60% of all Americans who said the same, according to a Wall Street Journal/NBC News poll.
On Wednesday, the campaign's talking points urged surrogates to tell supporters to listen to local and state authorities. The only mention of Mr. Biden: Noting that his
sweep of primary contests
on Tuesday would put pressure on Sen. Bernie Sanders to give up his campaign.
Still, campaign officials and advisers cautioned that the tactics are evolving.
While the campaign is unlikely to run any new ads focused on the economy, as officials were considering earlier this month, some believe those spots could be airing again by the fall. Mr. Trump and his team have careened from one political crisis to the next since the 2016 election, and there has been little change in his approval rating since he took office.
""Look, if in 45 days it looks like everything is going back to normal,"" one adviser said, ""then everything is going to go back to where it was.""
WSJ Newsletter
Get an early-morning coronavirus briefing each weekday, plus a health-news update Fridays:
Sign up here.

Write to Alex Leary at
alex.leary@wsj.com
and Michael C. Bender at
Mike.Bender@wsj.com

Credit: By Alex Leary and Michael C. Bender Word count: 1175Show lessYou have requested ""on-the-fly"" machine translation of selected content from our databases. This functionality is provided solely for your convenience and is in no way intended to replace human translation. Show full disclaimerNeither ProQuest nor its licensors make any representations or warranties with respect to the translations. The translations are automatically generated ""AS IS"" and ""AS AVAILABLE"" and are not retained in our systems. PROQUEST AND ITS LICENSORS SPECIFICALLY DISCLAIM ANY AND ALL EXPRESS OR IMPLIED WARRANTIES, INCLUDING WITHOUT LIMITATION, ANY WARRANTIES FOR AVAILABILITY, ACCURACY, TIMELINESS, COMPLETENESS, NON-INFRINGMENT, MERCHANTABILITY OR FITNESS FOR A PARTICULAR PURPOSE. Your use of the translations is subject to all use restrictions contained in your Electronic Products License Agreement and by using the translation functionality you agree to forgo any and all claims against ProQuest or its licensors for your use of the translation functionality and any output derived there from. Hide full disclaimer

Longer documents can take a while to translate. Rather than keep you waiting, we have only translated the first few paragraphs. Click the button below if you want to translate the rest of the document.
Translate AllCopyright 2020 Dow Jones & Company, Inc. All Rights Reserved.","Wall Street Journal (Online)","1175"
"1585369282-674","https://search-proquest-com.proxygw.wrlc.org/results/F74DC863F010412CPQ/1?accountid=11243","Full text","https://search-proquest-com.proxygw.wrlc.org/docview/2332068544/fulltext/F74DC863F010412CPQ/87?accountid=11243","Trump Campaign Looks to Build Evangelical Support With Minority Outreach; Event at Florida church comes weeks after critical editorial showed division in conservative Christian base","Hide highlightingFull TextTranslateUndo Translation FromToTranslateTranslation in progress... 

[[missing key: loadingAnimation]]The full text may take 40-120 seconds to translate; larger documents may take longer.

Cancel
OverlayEndTurn on search term navigationTurn on search term navigation
| Jump to first hit
MIAMI—President Trump launched an effort to expand the conservative Christian support that helped power him to the White House from a Miami megachurch, making an appeal to Hispanic evangelicals.
At King Jesus International Ministry, Mr. Trump unveiled an ""Evangelicals for Trump"" coalition Friday. The event had the hallmarks of a campaign rally, packed with attendees in Trump garb, but also opened with religious music and prayer. Evangelical leaders in attendance included Tony Perkins, president of the Family Research Council, and Paula White, who works for the White House as an adviser to the Faith and Opportunity Initiative, as well as King Jesus Ministry's pastor, Guillermo Maldonado.
""In 2016, evangelical Christians helped us...they went out and they worked so hard and they produced numbers like they never produced before,"" Mr. Trump said. ""We're going to blow those numbers away in 2020.""
Campaign spokeswoman Kayleigh McEnany said the coalition aims to sign up thousands of members and would seek to ""maintain the extraordinary support of the evangelical community but also to expand it.""
She added: ""We definitely see we can make inroads with black and Hispanic evangelicals,"" arguing that the president's record on religious issues would be appealing to those voters.
At the event, Mr. Trump acknowledged ""so many extraordinary Hispanic and African-American faith leaders who are lifting our nation to incredible new heights.""
A key piece of the president's winning 2016 coalition, evangelical Christians still overwhelmingly back Mr. Trump, applauding his efforts to restrict abortion access and appoint conservative judges, while largely looking past the combative style that recent polling showed was
working against him with some voters
. Since taking office, the president has stayed close to evangelical leaders, regularly meeting with pastors and setting up an initiative that aims to give religious groups more influence on policy.
""I may not be perfect but I get things done,"" joked Mr. Trump. He stressed his record on judges and abortion as well as recognizing Jerusalem as the capital of Israel and rolling back restrictions on political activity by houses of worship. He also pledged to soon take ""action to safeguard students and teachers' First Amendment rights to pray in our schools.""
Mr. Trump's approval rating in the December poll by The Wall Street Journal and NBC News was 34% among Hispanics, with 64% disapproving. That compared with 44% approval and 54% disapproval among adults overall. The poll also found Hispanic registered voters were among the groups most up for grabs in the coming election, with one-quarter saying their decision on whether to vote for or against Mr. Trump would depend on who the Democrats nominate.
At the event, Mr. Trump also stressed low unemployment numbers and a criminal-justice overhaul, as he sought to court minority voters. He also repeatedly targeted Democrats, saying his opponents ""want to shut out God from the public square.""
The Florida location Friday provided Mr. Trump the opportunity to target a segment of Hispanic voters in a battleground state. While the majority of evangelicals are white, Hispanics represent 11% and 6% are black, according to a 2014 study by the Pew Research Center.
Thomas Kidd, a professor at Baylor University and the author of ""Who Is an Evangelical?: The History of a Movement in Crisis,"" said that white evangelicals tend to vote Republican and black evangelicals favor Democrats, but Latino evangelicals are more divided politically.
""I think in general that Latino evangelicals are the most interesting group of evangelicals politically because their allegiances are up for grabs,"" he said.
Ms. McEnany said the campaign would focus on both groups, arguing that ""if you are in the faith community, President Trump has made good on his promises.""
The rollout comes just weeks after Christianity Today, an evangelical magazine, published an editorial criticizing Mr. Trump and
calling for his removal from office
. Mr. Trump and many of his evangelical allies reacted with fury, dismissing the article as an isolated voice of dissent, but it served as a reminder that the president's support in the community has at least a few cracks.
The magazine's president, Timothy Dalrymple, said in a statement that the editorial wasn't written in a ""calculated way,"" but ""according to conscience"" and noted that subscriptions have risen overall since its publication on Dec. 19.
""Clearly there's a large pool of evangelicals who are deeply uncomfortable with the evangelical embrace of the president,"" said Mr. Dalrymple, who said the magazine saw 3,000 cancellations and a little over 11,000 new subscriptions.
A new poll from the Associated Press-NORC Center for Public Affairs Research showed that about 8 in 10 white evangelicals approve of the president's job performance. The survey showed that the group didn't back all of his policy moves, with a majority opposed to a policy of
separating migrant families that cross into the U.S. illegally
.
SHARE YOUR THOUGHTS
How important are a leader's religious beliefs to you when casting your vote? Why? Join the conversation below.
Mr. Trump also drew criticism from some evangelical leaders recently when he sought to withdraw U.S. troops from Syria, with pastors expressing concern about Christian minorities in the region.
Mr. Trump's campaign announced the Friday event soon after the Christianity Today editorial was published, but Ms. McEnany said that the timing wasn't related. This is the latest coalition group announced by the campaign, which has already unveiled efforts to
target African-Americans
,
Latinos
and women. The Latino group features several pastors.
Rev. Maldonado, who has visited the White House several times, will serve on the Evangelicals for Trump Coalition in a personal capacity, according to a statement on the church's website. The statement also said the church is nonpartisan and that the event shouldn't be viewed as an endorsement of Mr. Trump.
Rev. Samuel Rodriguez, president of the National Hispanic Christian Leadership Conference, argued there was room for Mr. Trump to expand his evangelical support.
""He hasn't hit the ceiling, he hasn't hit the lid. There is room. There is room not just because of the policies, but because of the alternatives,"" said Mr. Rodriguez, who advises Mr. Trump, as he did former Presidents Barack Obama and George W. Bush. Of the kickoff event, he said: ""Florida, Latino and evangelical, check mark, check mark, check mark.""
Write to Catherine Lucey at
catherine.lucey@wsj.com

Credit: By Catherine Lucey Word count: 1048Show lessYou have requested ""on-the-fly"" machine translation of selected content from our databases. This functionality is provided solely for your convenience and is in no way intended to replace human translation. Show full disclaimerNeither ProQuest nor its licensors make any representations or warranties with respect to the translations. The translations are automatically generated ""AS IS"" and ""AS AVAILABLE"" and are not retained in our systems. PROQUEST AND ITS LICENSORS SPECIFICALLY DISCLAIM ANY AND ALL EXPRESS OR IMPLIED WARRANTIES, INCLUDING WITHOUT LIMITATION, ANY WARRANTIES FOR AVAILABILITY, ACCURACY, TIMELINESS, COMPLETENESS, NON-INFRINGMENT, MERCHANTABILITY OR FITNESS FOR A PARTICULAR PURPOSE. Your use of the translations is subject to all use restrictions contained in your Electronic Products License Agreement and by using the translation functionality you agree to forgo any and all claims against ProQuest or its licensors for your use of the translation functionality and any output derived there from. Hide full disclaimer

Longer documents can take a while to translate. Rather than keep you waiting, we have only translated the first few paragraphs. Click the button below if you want to translate the rest of the document.
Translate AllCopyright 2020 Dow Jones & Company, Inc. All Rights Reserved.","Wall Street Journal (Online)","1048"
