web-scraper-order,web-scraper-start-url,link,link-href,title,text,media,word_count
"1585369716-701","https://search-proquest-com.proxygw.wrlc.org/results/F74DC863F010412CPQ/1?accountid=11243","Full text","https://search-proquest-com.proxygw.wrlc.org/docview/2351762804/fulltext/F74DC863F010412CPQ/60?accountid=11243","On Big Stage, Trump Aims Message at Black Voters; The president used both the State of the Union and his Super Bowl campaign ad to court African-Americans, who disapprove of him by wide margins","Hide highlightingFull TextTranslateUndo Translation FromToTranslateTranslation in progress... 

[[missing key: loadingAnimation]]The full text may take 40-120 seconds to translate; larger documents may take longer.

Cancel
OverlayEndTurn on search term navigationTurn on search term navigation
| Jump to first hit
WASHINGTON—President Trump has had two major national audiences in the past five days, and both times he aimed a message at African-Americans, a group that overwhelmingly disapproves of the job he is doing but could help decide whether he gets to keep it.
During the Super Bowl, Mr. Trump's campaign spent millions of dollars on a commercial featuring an African-American woman who had a drug sentence commuted by the president. ""Politicians talk about criminal-justice reform,"" the ad said. ""President Trump got it done.""
At the State of the Union, Mr. Trump celebrated the low unemployment rate among African-Americans, talked of urban development zones, honored one of the last surviving Tuskegee Airmen and awarded a fourth-grader from Philadelphia, Janiyah Davis, with a school-choice scholarship.
The black unemployment rate is 5.9%, according to the latest government statistics, up slightly from the historic low of 5.4% reached in August 2019. Overall, the U.S. unemployment rate is 3.5%.
While Mr. Trump's re-election strategy mainly relies on motivating his conservative base, the focus on African-Americans, and a similar push for Hispanics, shows an effort to attract new voters. Only 8% of black voters went for Mr. Trump in 2016, but his campaign is confident it can improve on that. Even a small boost could help in battleground states such as Florida, Georgia, North Carolina, Virginia, Pennsylvania, Wisconsin and Michigan.
Related
*
Trump Touts Economy, Ignores Impeachment in State of the Union Speech

*
Trump's Second-Term Agenda Still on the Drawing Board

*
As Primary Voting Nears, Joe Biden Remains Strong With Black Democrats

*
Many Black Voters Like Joe Biden, but Some Are Open to Other Democrats

""There's significant support out there that you're not going to hear about but it will show up at the ballot box. People see results,"" said Calvin Tucker, who directs minority outreach for the Republican Party of Pennsylvania. He noted that Mr. Trump in 2016 did better among black voters than the past two Republican nominees, Mitt Romney and John McCain.
The push Mr. Trump has displayed in the last week—chiefly the emotional Super Bowl ad, which generated favorable reviews—also appears intended for another group of voters he has struggled with.
""Ads showing the compassionate part of Trump's agenda could help raise his favorable ratings with some suburban voters,"" said Alex Conant, a Republican strategist in Washington. ""They like his economic policies, but are turned off by the tweets and harsh rhetoric.""
The Trump campaign has been holding outreach events, seeking to shake the decadeslong dominance Democrats have held with black voters. It is a far different effort than 2016, when Mr. Trump lacked a record and simply asked, ""What the hell do you have to lose?""
The campaign plans to continue an advertising campaign geared toward black voters, including African-American community newspapers and radio. Ads encourage people to text ""woke"" to receive updates. The campaign is also training activists to engage and register voters, according to a person familiar with the strategy.
With a strong economy at the president's back, some Democrats say Mr. Trump's outreach is a wake-up call.
""What we saw from Donald Trump was a 2020 surgical strategy,"" said Quentin James, founder of the Collective PAC, which helps elect black candidates to office. Mr. James said Democrats need a large-scale program to engage with African-Americans and fears the party will play catch-up.
""We assume black voters will just vote for the Democratic Party like they always do,"" he said. ""Sure the numbers are there, but if Trump can get two or three more points with black men in swing states, this thing is over. I am very nervous.""
Michael Steele, a former chairman of the Republican National Committee who is also African-American, said Mr. Trump was smart to make a play for black voters. But he said that effort is hampered by the president's history of controversial statements, from saying there were fine people on ""both sides"" of the deadly 2017 white nationalist rally in Charlottesville, Va., to saying four Democratic lawmakers, all of them minority women, should return to the ""totally broken and crime infested places from which they came"" and ""fix"" them.
SHARE YOUR THOUGHTS
Do you think President Trump can improve on his 2016 performance among African-American voters? Join the conversation below.
""This is a man who wanted to execute the Central Park Five,"" said Mr. Steele, referring to the black and Hispanic teenagers who were wrongfully convicted of raping a jogger in 1989. Asked about the case last year, Mr. Trump refused to apologize for his stance, which he had emphasized at the time in newspaper ads that called for bringing back the death penalty in New York.
A January poll released by the Washington Post showed more than 8 in 10 black Americans think Mr. Trump is a racist and that he has made racism a bigger problem. Despite Mr. Trump's boasts about the economy, 77% of black Americans said he deserves only ""some"" or ""hardly any"" credit, according to the poll.
""You go in the barber shop and talk to people—they hate Donald Trump,"" said Keith Williams, chairman of the Michigan Democratic Party's black caucus. He said Mr. Trump's frequent criticisms of former President Obama were a sore spot and noted the economic recovery began under Mr. Trump's predecessor.
""He can bring people to the State of the Union but he's never been for us,"" Mr. Williams said.
A Wall Street Journal/NBC News poll from January showed only 15% of African-Americans approve of the job Mr. Trump is doing, and 83% disapprove—by far the worst of any demographic group.
Still, another Journal poll in December showed Mr. Trump could improve on his 2016 margin. While only 9% of blacks were almost certain to vote for the president and 72% were almost certain to vote against him, 21% said it depends on whom Democrats nominate.
Aaron Zitner contributed to this article.
Write to Alex Leary at
alex.leary@wsj.com

Credit: By Alex Leary Word count: 992Show lessYou have requested ""on-the-fly"" machine translation of selected content from our databases. This functionality is provided solely for your convenience and is in no way intended to replace human translation. Show full disclaimerNeither ProQuest nor its licensors make any representations or warranties with respect to the translations. The translations are automatically generated ""AS IS"" and ""AS AVAILABLE"" and are not retained in our systems. PROQUEST AND ITS LICENSORS SPECIFICALLY DISCLAIM ANY AND ALL EXPRESS OR IMPLIED WARRANTIES, INCLUDING WITHOUT LIMITATION, ANY WARRANTIES FOR AVAILABILITY, ACCURACY, TIMELINESS, COMPLETENESS, NON-INFRINGMENT, MERCHANTABILITY OR FITNESS FOR A PARTICULAR PURPOSE. Your use of the translations is subject to all use restrictions contained in your Electronic Products License Agreement and by using the translation functionality you agree to forgo any and all claims against ProQuest or its licensors for your use of the translation functionality and any output derived there from. Hide full disclaimer

Longer documents can take a while to translate. Rather than keep you waiting, we have only translated the first few paragraphs. Click the button below if you want to translate the rest of the document.
Translate AllCopyright 2020 Dow Jones & Company, Inc. All Rights Reserved.","Wall Street Journal (Online)","992"
"1585369828-708","https://search-proquest-com.proxygw.wrlc.org/results/F74DC863F010412CPQ/1?accountid=11243","Full text","https://search-proquest-com.proxygw.wrlc.org/docview/2346184697/fulltext/F74DC863F010412CPQ/53?accountid=11243","U.S. News: President's Campaign Targets Iowa --- Trump and his allies will visit state in show of strength for next week's caucuses","Hide highlightingFull TextTranslateUndo Translation FromToTranslateTranslation in progress... 

[[missing key: loadingAnimation]]The full text may take 40-120 seconds to translate; larger documents may take longer.

Cancel
OverlayEndTurn on search term navigationTurn on search term navigation
| Jump to first hit
With the leadoff Iowa caucuses days away, President Trump's re-election campaign wants to remind voters that Democrats aren't the only game in town.
For the Feb. 3 caucuses, the Trump campaign is planning an ambitious show of force around the state, with over 80 surrogates expected to campaign at caucus locations. The push will be led by campaign manager Brad Parscale, the president's sons Donald Trump Jr. and Eric Trump, as well as Eric Trump's wife Lara Trump, who works for the campaign, and Donald Trump Jr.'s girlfriend Kimberly Guilfoyle, also a campaign adviser.
The group heading to Iowa includes White House acting chief of staff Mick Mulvaney and a number of cabinet members, including Commerce Secretary Wilbur Ross, Health and Human Services Secretary Alex Azar, Education Secretary Betsy DeVos and Housing and Urban Development Secretary Ben Carson. Also attending are members of Congress, among them House Minority Leader Kevin McCarthy (R., Calif.), Rep. Elise Stefanik, (R., N.Y.) and Rep. Mark Meadows (R., N.C.), as well as Iowa Gov. Kim Reynolds and governors from surrounding states.
Four years ago, President Trump placed second in the Iowa caucuses. This time around he has no strong challenger and Republican turnout is expected to be light. Still, the campaign sees the night as an opportunity to test its organizational muscle across the state's 99 counties and put on a show of strength in a key general election state.
""Our Caucus Day operation is just a preview of what is to come,"" said Mr. Parscale, in a statement provided to The Wall Street Journal. ""This will be the strongest, best funded, and most organized presidential campaign in history.""
The president is also heading to Des Moines on Thursday for a rally in advance of the caucuses, and Vice President Mike Pence is planning a bus tour through the state that day. The campaign has held caucus training sessions and Lara Trump recently issued a video detailing how to participate.
""By attending your caucus you can show your support for the president and send a clear message to the rest of the country,"" she said.
Mr. Trump has made clear he plans to leave nothing to chance in Iowa, a state he captured by nearly 10 percentage points in 2016 over Hillary Clinton but that Barack Obama won in 2008 and 2012. He has stayed close to Iowa Republicans, visiting the state throughout his presidency.
Some states have opted not to hold Republican primaries this year, but Iowa -- ever mindful of its first-in-the-nation status -- has kept the GOP contest going.
""When you're a first-in-the- nation state, you can't take off an election cycle,"" said Iowa Republican Party Chairman Jeff Kaufmann. ""We need to make sure both parties are out front and showing the country that we're going to do things in a transparent way and an efficient way.""
On the evening of Feb. 3, Republicans and Democrats will gather in nearly 1,700 precinct locations to pick their choice to be the party nominee. The GOP process is more straightforward than the Democratic approach, with Republicans simply casting a vote. The caucus results ultimately determine the delegates that represent the state at the Republican convention in August.
Mr. Trump has followed the Democratic nomination fight.
Speaking to Fox Business recently, he said of Vermont Sen. Bernie Sanders: ""I don't know, maybe he's really surging. He really is,"" while adding that Massachusetts Sen. ""Elizabeth Warren seems to be going in the other way."" Of former Vice President Joe Biden, Mr. Trump said he ""doesn't seem to be doing too well.""
Although the president's impeachment trial will continue this week, the push in Iowa comes as he has been or will be central to several other events.
He is holding a rally in New Jersey this week, as well as a meeting with Israeli leaders. On Friday, he became the first president to address the March for Life in Washington in person.


Credit: By Catherine Lucey Word count: 661Show lessYou have requested ""on-the-fly"" machine translation of selected content from our databases. This functionality is provided solely for your convenience and is in no way intended to replace human translation. Show full disclaimerNeither ProQuest nor its licensors make any representations or warranties with respect to the translations. The translations are automatically generated ""AS IS"" and ""AS AVAILABLE"" and are not retained in our systems. PROQUEST AND ITS LICENSORS SPECIFICALLY DISCLAIM ANY AND ALL EXPRESS OR IMPLIED WARRANTIES, INCLUDING WITHOUT LIMITATION, ANY WARRANTIES FOR AVAILABILITY, ACCURACY, TIMELINESS, COMPLETENESS, NON-INFRINGMENT, MERCHANTABILITY OR FITNESS FOR A PARTICULAR PURPOSE. Your use of the translations is subject to all use restrictions contained in your Electronic Products License Agreement and by using the translation functionality you agree to forgo any and all claims against ProQuest or its licensors for your use of the translation functionality and any output derived there from. Hide full disclaimer

Longer documents can take a while to translate. Rather than keep you waiting, we have only translated the first few paragraphs. Click the button below if you want to translate the rest of the document.
Translate AllCopyright 2020 Dow Jones & Company, Inc. All Rights Reserved.","Wall Street Journal","661"
"1585370294-737","https://search-proquest-com.proxygw.wrlc.org/results/F74DC863F010412CPQ/1?accountid=11243","Full text","https://search-proquest-com.proxygw.wrlc.org/docview/2342330043/fulltext/F74DC863F010412CPQ/24?accountid=11243","Trump Lauds U.S. Economy as He Opens World Economic Forum; President reels off a list of economic achievements, hours before his Senate impeachment trial","Hide highlightingFull TextTranslateUndo Translation FromToTranslateTranslation in progress... 

[[missing key: loadingAnimation]]The full text may take 40-120 seconds to translate; larger documents may take longer.

Cancel
OverlayEndTurn on search term navigationTurn on search term navigation
| Jump to first hit
DAVOS, Switzerland—President Trump touted what he described as a ""blue-collar boom"" transforming the American economy and hailed
the U.S. trade agreement with China
in a speech to global business and government leaders, hours before
his impeachment trial
was set to begin.
Over 30 minutes on Tuesday, Mr. Trump ticked off a list of accomplishments from
low unemployment
to increases in foreign investment. The campaign-style address appeared aimed as much at a U.S. re-election audience and the 100 senators who will act as jurors in his impeachment trial as at the other heads of state and business executives attending the
World Economic Forum
in this Swiss mountain resort.
""The American dream is back, bigger, better and stronger than ever before,"" Mr. Trump said. ""No one is benefiting more than America's middle class.""
Before the Davos crowd of several hundred global business and political leaders, he took a shot at his domestic political opponents, saying, ""We will never let radical socialists destroy our economy, wreck our country, or eradicate our liberty.""
The president also reiterated his administration's promise for a middle-class tax cut. He told The Wall Street Journal it would be subject to his re-election and GOP gains in the House, where Democrats now hold a several-dozen seat majority. Administration officials have been talking for months about another round of tax cuts they would layer on top of those Mr. Trump signed in 2017, but the White House hasn't released a detailed proposal.
SHARE YOUR THOUGHTS
How do you think President Trump portrayed himself and the U.S. during his speech? Join the conversation below.
In a remark in his speech widely understood as referring to climate-change activists, he urged the world to ""reject the perennial prophets of doom and their predictions of the apocalypse,"" whom he described as ""the heirs of yesterday's foolish fortunetellers.""
After Mr. Trump's speech, Axel Weber, chairman of Swiss bank UBS Group AG, said it ""was a typical sales pitch of the CEO in Davos overselling the company's achievements and underreporting on some of the risks that are there.""
David McKay, chief executive of Royal Bank of Canada, said that, based on his meetings in Davos so far, business leaders shared Mr. Trump's optimism. ""There's a general positivity about economic opportunity in the U.S.,"" Mr. McKay said.
Year-over-year growth
cooled to 2.1%
in the third quarter of last year from 3.2% in the second quarter of 2018. The U.S. has been in a period of uninterrupted growth since 2009.
As Mr. Trump crisscrossed a conference hall for the event, he was surrounded by crowds, with attendees jostling to get a look at him.
Mr. Trump had bilateral meetings with world leaders throughout the day, but he was particularly interested in what business executives he spoke with thought about his speech, according to people familiar with the matter.
Some in Davos disagreed with Mr. Trump, but attendees at a dinner Tuesday night took turns praising him one at a time.
FIFA president Gianni Infantino, compared Mr. Trump with the world-class athletes he often interacts with. ""President Trump is made of the same sort of fiber. He is competitive,"" he said, adding, ""He wants to win.""
White House aides said the president remained focused throughout the day on his meetings at Davos. In the interview with the Journal, Mr. Trump paused several times to comment on Fox News segments playing on a television nearby. At one point, he pointed out a pro-Trump banner in the crowd at a pro-rights rally in Virginia that flashed across the screen.
The six-hour time difference in Davos gave Mr. Trump plenty of time to watch the Senate trial from his hotel. During his motorcade back to the hotel Tuesday night, he tweeted ""READ THE TRANSCRIPTS,"" indicating that the impeachment proceedings were very much on his mind.
Tuesday was Mr. Trump's second appearance at the summit as president. In 2018, he sought to reassure world leaders and business executives that there was a place for global cooperation in his nationalist worldview. ""'America First' does not mean America alone,"" he said at the time.
His speech at the summit coincides with the first day of a trial in the U.S. Senate to determine whether he should be removed from office. In a legal filing Monday, Mr. Trump's legal team urged the Senate to swiftly reject the articles of impeachment,
calling the case frivolous and dangerous
.
More From the World Economic Forum
*
Trump Doubles Down on Threats to Impose Tariffs on European Cars

*
Mnuchin Warns U.K., Italy Over Digital-Tax Plans

*
The Great U.S.-China Tech Divide

*
2020 Outlook: Receding Risks, Stronger Growth

*
Updates From the World Economic Forum

Mr. Trump's remarks focused on the vibrancy of the American economy and the benefits he said he had delivered for people left behind in earlier booms, emphasizing employment gains by people without college degrees, African-Americans and military veterans.
In
his interview with the Journal
, the president said the administration was preparing a proposal for a middle-class tax cut to be unveiled in the next 90 days.
""Very much of a workers' tax cut,"" he said. He said its passage would come after the 2020 election and would depend on his winning a second term and Republicans holding the Senate and retaking the House.
While the president and his allies will tout the promised middle-class tax cut during the 2020 campaign, it has little chance of passing a Democratic-controlled House of Representatives. Democrats favor some tax cuts for middle-income and lower-income households, but they also want to roll back pieces of the 2017 law that benefited high-income taxpayers and corporations.
In his speech, the president addressed the issue of inequality, saying that wages for low-income Americans have been growing faster than those of the richest. ""For the first time in decades, we're not only concentrating wealth in the hands of a few,"" he said.
The U.S. labor market is in a strong spot, with the unemployment rate having held at a 50-year low of 3.5% in December.
Wages for rank-and-file workers have been rising at the quickest pace in more than a decade, even faster than for bosses, a sign that the labor market has tightened sufficiently to convey bigger increases to lower-paid employees. Pay for the bottom 25% of wage earners rose 4.6% in December from a year earlier, according to the Federal Reserve Bank of Atlanta. Wages for the top 25% of earners rose 3%.
The What's News Briefing In Your Inbox
Get What's News, a daily digest of the day's most important news to watch, delivered to your inbox.
Sign up.

Harriet Torry and Richard Rubin contributed to this article.
Write to Andrew Restuccia at
Andrew.Restuccia@wsj.com

Credit: By Andrew Restuccia Word count: 1121Show lessYou have requested ""on-the-fly"" machine translation of selected content from our databases. This functionality is provided solely for your convenience and is in no way intended to replace human translation. Show full disclaimerNeither ProQuest nor its licensors make any representations or warranties with respect to the translations. The translations are automatically generated ""AS IS"" and ""AS AVAILABLE"" and are not retained in our systems. PROQUEST AND ITS LICENSORS SPECIFICALLY DISCLAIM ANY AND ALL EXPRESS OR IMPLIED WARRANTIES, INCLUDING WITHOUT LIMITATION, ANY WARRANTIES FOR AVAILABILITY, ACCURACY, TIMELINESS, COMPLETENESS, NON-INFRINGMENT, MERCHANTABILITY OR FITNESS FOR A PARTICULAR PURPOSE. Your use of the translations is subject to all use restrictions contained in your Electronic Products License Agreement and by using the translation functionality you agree to forgo any and all claims against ProQuest or its licensors for your use of the translation functionality and any output derived there from. Hide full disclaimer

Longer documents can take a while to translate. Rather than keep you waiting, we have only translated the first few paragraphs. Click the button below if you want to translate the rest of the document.
Translate AllCopyright 2020 Dow Jones & Company, Inc. All Rights Reserved.","Wall Street Journal (Online)","1121"
