web-scraper-order,web-scraper-start-url,link,link-href,title,text,media,word_count
"1585369314-676","https://search-proquest-com.proxygw.wrlc.org/results/F74DC863F010412CPQ/1?accountid=11243","Full text","https://search-proquest-com.proxygw.wrlc.org/docview/2340451247/fulltext/F74DC863F010412CPQ/85?accountid=11243","Democrats Outline Case for Removing Trump; First documents in Senate impeachment trial filed, president's legal team responds","Hide highlightingFull TextTranslateUndo Translation FromToTranslateTranslation in progress... 

[[missing key: loadingAnimation]]The full text may take 40-120 seconds to translate; larger documents may take longer.

Cancel
OverlayEndTurn on search term navigationTurn on search term navigation
| Jump to first hit
WASHINGTON—House Democratic impeachment managers filed their first documents in the coming Senate trial, outlining how they plan to make the case for removing President Trump from office.

The Democrats' 111-page document, filed on Saturday
, outlines the case the seven impeachment managers plan to present to senators when the trial begins on Tuesday. In the filing, House Democrats tell senators, who serve as jurors in the trial, to follow the Constitution and ""rise above partisan differences"" as they hear the case.
""President Trump abused the power of his office to solicit foreign interference in our elections for his own personal political gain, thereby jeopardizing our national security, the integrity of our elections, and our democracy,"" the impeachment managers said in a statement.
The Democratic-led House approved
two articles of impeachment
against Mr. Trump last month. The first article of impeachment stems from Mr. Trump
pressing Ukraine to investigate
former Vice President Joe Biden, a leading candidate for the 2020 Democratic presidential nomination,
including by withholding almost $400 million in aid
to help Kyiv combat Russian aggression. The second article accuses Mr. Trump of impeding Congress's investigation by preventing witnesses from testifying and defying subpoenas for documentary evidence.
The president denies the accusations and says the transcripts from calls with Ukrainian President Volodymyr Zelensky show he did nothing wrong.
The president's legal team, in a
response posted on Saturday
, called the House impeachment articles ""a brazen and unlawful attempt to overturn the results of the 2016 election and interfere with the 2020 election"" and said the articles fail to allege any crime or violation.
Democrats counter that impeachment doesn't have to include a crime, and say abuse of power is an impeachable offense, according to an aide working on the inquiry.
Mr. Trump
finalized his legal team
for the Senate impeachment trial on Friday, choosing a group of attorneys with wide name recognition and TV experience, including constitutional-law professor Alan Dershowitz and former Whitewater Independent Counsel Kenneth Starr. The White House must formally respond to the House Democrats' brief by midday Monday.
House Democrats plan to allege the president interfered in the 2020 election by seeking investigations against his political rivals, and argue that senators are responsible for removing the resulting threat to national security.
""The Constitution provides a remedy when the President commits such serious abuses of his office: impeachment and removal,"" the Democrats wrote. ""The Senate must use that remedy now to safeguard the 2020 U.S. election, protect our constitutional form of government, and eliminate the threat that the President poses to America's national security.""
SHARE YOUR THOUGHTS
How would you respond to the impeachment trial brief from the White House's perspective? Join the conversation below.
Most of the material that the Democrats plan to use to make their case is already known. The brief does show that Democrats plan to cite documents released after the House voted to impeach the president. The brief cites documents released by Lev Parnas, an associate of Rudy Giuliani, and the decision announced last Thursday by the Government Accountability Office that the Trump administration didn't have the legal authority to put on hold millions of dollars in security assistance to Ukraine last summer.
Senate Majority Leader Mitch McConnell (R., Ky.) hasn't outlined how the trial will be structured, though he has said it would be similar to the procedures adopted for former President Bill Clinton. Mr. McConnell would need a simple majority of the Senate to pass rules for the trial, and with 53 Republican senators, he doesn't need bipartisan support.
While some GOP senators have said they would be open to hearing new witnesses, Senate Republicans are in agreement to delay a vote on witnesses until after the trial begins, according to people familiar with the plans. The White House doesn't believe there is a need to hear witness testimony in the Senate trial, a senior administration official said.
Democrats are seeking to introduce new witnesses and documents to make their case.
Democrats want to hear
from former national security adviser John Bolton and acting White House chief of staff Mick Mulvaney, who were directed by the White House not to testify before the House inquiry.
Write to Natalie Andrews at
Natalie.Andrews@wsj.com

Credit: By Natalie Andrews Word count: 706Show lessYou have requested ""on-the-fly"" machine translation of selected content from our databases. This functionality is provided solely for your convenience and is in no way intended to replace human translation. Show full disclaimerNeither ProQuest nor its licensors make any representations or warranties with respect to the translations. The translations are automatically generated ""AS IS"" and ""AS AVAILABLE"" and are not retained in our systems. PROQUEST AND ITS LICENSORS SPECIFICALLY DISCLAIM ANY AND ALL EXPRESS OR IMPLIED WARRANTIES, INCLUDING WITHOUT LIMITATION, ANY WARRANTIES FOR AVAILABILITY, ACCURACY, TIMELINESS, COMPLETENESS, NON-INFRINGMENT, MERCHANTABILITY OR FITNESS FOR A PARTICULAR PURPOSE. Your use of the translations is subject to all use restrictions contained in your Electronic Products License Agreement and by using the translation functionality you agree to forgo any and all claims against ProQuest or its licensors for your use of the translation functionality and any output derived there from. Hide full disclaimer

Longer documents can take a while to translate. Rather than keep you waiting, we have only translated the first few paragraphs. Click the button below if you want to translate the rest of the document.
Translate AllCopyright 2020 Dow Jones & Company, Inc. All Rights Reserved.","Wall Street Journal (Online)","706"
"1585370278-736","https://search-proquest-com.proxygw.wrlc.org/results/F74DC863F010412CPQ/1?accountid=11243","Full text","https://search-proquest-com.proxygw.wrlc.org/docview/2348394890/fulltext/F74DC863F010412CPQ/25?accountid=11243","Trump, Pence Show Off Contrasting Styles in Iowa Visits; GOP incumbents' re-election campaign seeks to leverage mass rallies as well as traditional politicking","Hide highlightingFull TextTranslateUndo Translation FromToTranslateTranslation in progress... 

[[missing key: loadingAnimation]]The full text may take 40-120 seconds to translate; larger documents may take longer.

Cancel
OverlayEndTurn on search term navigationTurn on search term navigation
| Jump to first hit
COUNCIL BLUFFS, Iowa—Hours before President Trump was to address a large crowd in Iowa's capital, Vice President Mike Pence opted for a traditional political pit stop that his boss rarely makes: He met with voters at a fast-food joint.
In between events Thursday, Mr. Pence stopped by a Culver's—a Midwestern staple known for its ""ButterBurgers"" and frozen custard. ""Trust me, I won't leave here without a burger,"" he assured a table of middle-aged men.
He also greeted a pastor, a pleasantly surprised mother with her little girl and a woman wearing a red shirt that said ""Capitalism"" in the style of the Coca-Cola logo who said she wanted to stand on the road with a pro-Trump sign. Mr. Pence got his burger—a Culver's deluxe with bacon, no fries—and was unfazed when the cashier mistakenly referred to him as ""Biden.""
With
Mr. Trump's impeachment trial
under way, both the president and vice president had Iowa plans Thursday as they seek to redirect attention to the 2020 race and energize the state's Republicans days before the Feb. 3 caucuses. While Mr. Trump was free to hit the campaign trail, four senators seeking to unseat him were stuck in Washington, serving as jurors weighing the charges against him.
The joint visits reflect their campaign's effort to boost turnout and test its organizational muscle in an important general-election state. They also illustrated the different roles the duo will play on the campaign trail, with Mr. Trump sticking to his signature mega-rallies and Mr. Pence checking in on smaller interest groups.
Mr. Pence crisscrossed Iowa on Thursday in a blue bus stamped with the campaign logo and a picture of the vice president flashing a wide grin beside Mr. Trump. During a speech before evangelical Christian voters in Sioux City, the vice president sought to keep the focus on his boss, declaring: ""I just spoke to him on the bus, told him I was in Sioux City, Iowa, and I think he sounded just a little bit jealous.""
Connie Schmett, co-chair of the Republican Party of Polk County, Iowa, said Mr. Trump and Mr. Pence were a good pair because of their different styles.
""With President Trump, we have so many people that are so excited about this man because he is not the normal politician,"" she said. ""Vice President Pence is a little more mainstream. He's soft-spoken. He's a kind man. I think they complement each other.""
During his previous campaign, Mr. Trump largely eschewed the intimate campaigning that Iowa caucus voters expect. He placed second in the Republican contest to Sen. Ted Cruz of Texas, who invested in traditional Iowa politicking, but won the state in the 2016 general election, exceeding Democrat Hillary Clinton's margin by nearly 10 percentage points.
SHARE YOUR THOUGHTS
What approach to campaigning do you prefer to see from presidential candidates? Why? Join the conversation below.
Throughout his campaign stops, Mr. Pence hammered talking points that Trump aides believe will resonate with Iowa Republicans: He dismissed the Democratic candidates as radical socialists, emphasized the administration's efforts to restrict abortion access and to protect gun rights and highlighted the condition of the U.S. economy.
Mr. Pence also criticized impeachment proceedings seeking to remove Mr. Trump from office, on
charges of abuse of power
and
obstruction of Congress
, as a ""shameful attempt to overthrow the will of the American people.""
The president and vice president are campaigning for re-election in a way that seeks to leverage both traditional stumping and the appeal of Mr. Trump's rallies. Mr. Pence was meeting with evangelical voters and veterans Thursday, both important coalitions for their campaign.
White House officials said Mr. Pence's events are meant to counterbalance the president's rallies with a more targeted approach—a formula the vice president has repeated in other states, including Michigan, Pennsylvania and Florida.
""It's a chance for him to gauge the reaction in a community,"" said Marc Short, the vice president's chief of staff, of Mr. Pence's frequent stops at diners and local restaurants. The White House works with the president's re-election campaign to help determine which parts of key states to visit, aides said.
Mr. Pence's appearance in Iowa four days before the caucuses is sure to revive questions about his own political ambitions. The vice president is widely believed to be interested in running for president himself someday. But Mr. Pence's aides bristled at the suggestion that his visit had the secondary benefit of building groundwork for an eventual campaign of his own.
Bob Vander Plaats, chief executive of the Family Leader, an Iowa organization of religious conservatives, said the vice president's meeting with evangelical voters shows that ""they're not going to take Iowa for granted and they're not going to take people of faith for granted.""
Mr. Trump's victory in Iowa in 2016 came after Barack Obama won the state in 2008 and 2012. Recent polls of Iowa show Mr. Trump in a close contest in hypothetical matchups against the leading Democratic candidates.
With no serious Republican challenger, the president is expected to win his party's caucuses easily, though GOP attendance is likely to be very light. Still, more than 80 campaign surrogates are scheduled to flood the state for the Feb. 3 voting, including cabinet officials, members of Congress and top campaign aides.
""We want to absolutely show how powerful of an organization we have, the kind of leaders we have, how serious Iowa is to us,"" said Eric Branstad, a campaign adviser in Iowa.
Write to Andrew Restuccia at
Andrew.Restuccia@wsj.com
and Catherine Lucey at
catherine.lucey@wsj.com

Credit: By Andrew Restuccia and Catherine Lucey Word count: 930Show lessYou have requested ""on-the-fly"" machine translation of selected content from our databases. This functionality is provided solely for your convenience and is in no way intended to replace human translation. Show full disclaimerNeither ProQuest nor its licensors make any representations or warranties with respect to the translations. The translations are automatically generated ""AS IS"" and ""AS AVAILABLE"" and are not retained in our systems. PROQUEST AND ITS LICENSORS SPECIFICALLY DISCLAIM ANY AND ALL EXPRESS OR IMPLIED WARRANTIES, INCLUDING WITHOUT LIMITATION, ANY WARRANTIES FOR AVAILABILITY, ACCURACY, TIMELINESS, COMPLETENESS, NON-INFRINGMENT, MERCHANTABILITY OR FITNESS FOR A PARTICULAR PURPOSE. Your use of the translations is subject to all use restrictions contained in your Electronic Products License Agreement and by using the translation functionality you agree to forgo any and all claims against ProQuest or its licensors for your use of the translation functionality and any output derived there from. Hide full disclaimer

Longer documents can take a while to translate. Rather than keep you waiting, we have only translated the first few paragraphs. Click the button below if you want to translate the rest of the document.
Translate AllCopyright 2020 Dow Jones & Company, Inc. All Rights Reserved.","Wall Street Journal (Online)","930"
"1585369908-713","https://search-proquest-com.proxygw.wrlc.org/results/F74DC863F010412CPQ/1?accountid=11243","Full text","https://search-proquest-com.proxygw.wrlc.org/docview/2337688287/fulltext/F74DC863F010412CPQ/48?accountid=11243","New Documents From Giuliani Associate Parnas Submitted for Impeachment Trial; Giuliani asked to meet Ukrainian leader with Trump's 'knowledge and consent'; texts indicate tracking of ambassador","Hide highlightingFull TextTranslateUndo Translation FromToTranslateTranslation in progress... 

[[missing key: loadingAnimation]]The full text may take 40-120 seconds to translate; larger documents may take longer.

Cancel
OverlayEndTurn on search term navigationTurn on search term navigation
| Jump to first hit
New documents in the impeachment probe into President Trump show that his personal lawyer, Rudy Giuliani, asked for a meeting with the Ukrainian president with Mr. Trump's ""knowledge and consent"" and that one of Mr. Giuliani's associates was sent text messages about tracking the U.S. ambassador's movements in the country.
House Democrats on Tuesday released the documents, aiming to incorporate them into the House record in time for the start of the
Senate's impeachment trial.

The documentation, some of which was kept confidential to protect personally sensitive information, includes text messages from Lev Parnas, an indicted associate of Mr. Giuliani. Among the material that Mr. Parnas provided to the House Intelligence Committee was a screenshot of a previously undisclosed May 10 letter from Mr. Giuliani to Ukraine's newly elected president, Volodymyr Zelensky. In the letter, Mr. Giuliani sought a meeting with Mr. Zelensky that would take ""no more than a half-hour of your time.""
Mr. Giuliani didn't say in the letter why he sought the meeting with Ukraine's president, but he had already said on Fox News that he
wanted information about Joe Biden
, his client's potential 2020 election rival, part of the effort that later in the year sparked the impeachment inquiry of Mr. Trump.
Mr. Zelensky didn't end up taking the meeting, fearful of getting sucked into a U.S. political drama.

Mr. Parnas was arrested in October
on campaign-finance charges along with his associate, Igor Fruman, both of whom have pleaded not guilty to the charges. The two men for months assisted Mr. Giuliani in his push for investigations in Ukraine. In recent days, a lawyer for Mr. Parnas said he turned over to the Intelligence Committee a trove of messages from Mr. Parnas's cellphones. The White House didn't respond to a request for comment.
Related
*
Senate Impeachment Trial Likely to Start Next Tuesday, McConnell Says

*
Russians Breached Burisma During Trump Impeachment Probe

*
Trump Uses Campaign Rally to Wade Into Democratic Debate

The communications also included messages that mentioned the then-ambassador to Ukraine, Marie Yovanovitch, whom
Mr. Trump later fired
. In his July phone call with Ukraine's president, after she had been removed from her post, Mr. Trump
described her as ""bad news""
and said she would ""go through some things."" Ms. Yovanovitch later testified that she
felt threatened by the disparaging comments
from the president and was alarmed by the State Department's failure to defend her.
In the documents released Tuesday, Robert F. Hyde, a congressional candidate in Connecticut, told Mr. Parnas in a March text message that he couldn't believe that Mr. Trump ""hasn't fired this bitch."" Mr. Hyde also texted messages about Ms. Yovanovitch's movements, sending texts such as ""they will let me know when she's on the move"" and adding that ""They are willing to help if we/you would like to pay a price"" and ""Guess you can do anything in Ukraine with the money."" Later, he said, ""if you want her out they need to make contact with security forces.""
Ms. Yovanovitch's lawyer, Lawrence Robbins, called for an investigation into whether the diplomat was being tracked.
""Needless to say, the notion that American citizens and others were monitoring Ambassador Yovanovitch's movements for unknown purposes is disturbing,"" Ms. Yovanovitch's lawyer said in a statement. ""We trust that the appropriate authorities will conduct an investigation to determine what happened.""
Mr. Hyde, in a series of tweets Tuesday, said he welcomed an investigation. He said he was never in Kyiv, and called it ""definitely laughable"" that Democrats were using ""some texts my buddy's and I wrote back to some dweeb we were playing with that we met a few times while we had a few drinks.""
The texts show Mr. Parnas also communicated with numerous Ukrainian officials, including Yuri Lutsenko, months before Ukraine's new regime ousted him as prosecutor general. Mr. Lutsenko, who was widely viewed as corrupt by Western diplomats, complained about Ms. Yovanovitch, the texts show, while also offering Mr. Parnas information about the Bidens.
The Democratic-led House last month voted to impeach Mr. Trump on charges of abuse of power and obstruction of Congress. The articles of impeachment accuse him of pressuring Ukraine to open investigations that would benefit him politically. Mr. Trump has said he did nothing wrong.
""These documents—and those recently released pursuant to Freedom of Information Act—demonstrate that there is more evidence relevant to the President's scheme, but they have been concealed by the President himself,"" House Intelligence Committee Chairman Adam Schiff (D., Calif.) and other Democratic chairmen of the committees that ran the impeachment probe wrote in a letter. ""All of this new evidence confirms what we already know: the President and his associates pressured Ukrainian officials to announce investigations that would benefit the President politically. There cannot be a full and fair trial in the Senate without the documents that President Trump is refusing to provide to Congress.""
The House is
expected to vote Wednesday
to transmit the obstruction-of-Congress and abuse-of-power impeachment articles to the Senate, which is expected to begin a trial next week after taking ceremonial steps such as swearing in senators as jurors.
Mr. Parnas also turned over notes that were handwritten on stationery from a Vienna hotel in which he wrote, ""get Zalensky to Annonce that the Biden case will Be Investigated,"" incorporating misspellings into his notes, the committees said. That refers to the probe Mr. Trump had asked Ukraine's leader to announce into an energy company that Mr. Biden's son Hunter Biden had been associated with. Both Bidens deny any wrongdoing.
Mr. Parnas took those notes following a phone conversation with Mr. Giuliani in June, weeks after Mr. Zelensky's inauguration, according to his lawyer, Joseph Bondy. The previous month, Mr. Parnas had met with Serhiy Shefir, a top adviser to Mr. Zelensky, in Kyiv.
The communications were made via encrypted messaging applications, particularly WhatsApp, the committees said, and included conversations that often took place in Russian with senior Ukrainian officials in 2019. The communications ""demonstrate that Mr. Parnas served as a direct channel between President Trump's agent, Mr. Giuliani, and individuals close to President Volodymyr Zelensky,"" the committees said.
Mr. Giuliani, asked about that conversation, said in a text message: ""I was pursuing evidence in my role as private counsel defending my client."" Asked whether he recalled the conversation in June, he said: ""By that time meeting with Zelensky was off the table but it would have been for same purpose."" He added of Mr. Parnas: ""I dispute anything his lawyer says.""
Michael C. Bender and Rebecca Ballhaus contributed to this article.
Write to Siobhan Hughes at
siobhan.hughes@wsj.com

Credit: By Siobhan Hughes Word count: 1105Show lessYou have requested ""on-the-fly"" machine translation of selected content from our databases. This functionality is provided solely for your convenience and is in no way intended to replace human translation. Show full disclaimerNeither ProQuest nor its licensors make any representations or warranties with respect to the translations. The translations are automatically generated ""AS IS"" and ""AS AVAILABLE"" and are not retained in our systems. PROQUEST AND ITS LICENSORS SPECIFICALLY DISCLAIM ANY AND ALL EXPRESS OR IMPLIED WARRANTIES, INCLUDING WITHOUT LIMITATION, ANY WARRANTIES FOR AVAILABILITY, ACCURACY, TIMELINESS, COMPLETENESS, NON-INFRINGMENT, MERCHANTABILITY OR FITNESS FOR A PARTICULAR PURPOSE. Your use of the translations is subject to all use restrictions contained in your Electronic Products License Agreement and by using the translation functionality you agree to forgo any and all claims against ProQuest or its licensors for your use of the translation functionality and any output derived there from. Hide full disclaimer

Longer documents can take a while to translate. Rather than keep you waiting, we have only translated the first few paragraphs. Click the button below if you want to translate the rest of the document.
Translate AllCopyright 2020 Dow Jones & Company, Inc. All Rights Reserved.","Wall Street Journal (Online)","1105"
