web-scraper-order,web-scraper-start-url,link,link-href,title,text,media,word_count
"1585370518-751","https://search-proquest-com.proxygw.wrlc.org/results/F74DC863F010412CPQ/1?accountid=11243","Full text","https://search-proquest-com.proxygw.wrlc.org/docview/2331607341/fulltext/F74DC863F010412CPQ/10?accountid=11243","Trump's Tumultuous Year, From Policy Wins to Impeachment; The president started his third year during a government shutdown and concluded it impeached, scoring some victories along the way","Hide highlightingFull TextTranslateUndo Translation FromToTranslateTranslation in progress... 

[[missing key: loadingAnimation]]The full text may take 40-120 seconds to translate; larger documents may take longer.

Cancel
OverlayEndTurn on search term navigationTurn on search term navigation
| Jump to first hit
President Trump ended 2019 with a strong economy, a string of domestic policy achievements—and the notoriety of becoming the third president to be impeached by the House.
The mix of political highs and lows that has characterized Mr. Trump's presidency was especially pronounced in his third year. He welcomed a
special counsel report
that found insufficient evidence the Trump campaign conspired with Russia to interfere in the 2016 election, though it drew no conclusion about whether the president obstructed justice. But his efforts to push Ukraine to investigate a political rival led to his
historic rebuke by the House
.
Kicking off during a
government shutdown
, Mr. Trump's year had no shortage of other unexpected and polarizing moments. He clashed with House Speaker Nancy Pelosi (D., Calif.), but also signed some deals with Democrats. He
shook hands
with North Korea's Kim Jong Un in the demilitarized zone at the inter-Korean border and attended a state banquet at Buckingham Palace. He feuded with four freshman Democratic lawmakers known as the ""squad"" and expressed interest in
potentially buying Greenland
. He celebrated a U.S.-led raid that resulted in the death of an Islamic State leader and hosted the military dog involved in the operation at the White House.
Playing out before a deeply divided nation, 2019 provided the president with some policy wins to tout on the campaign trail, as well as plenty of material for his potential opponents to pounce on. For his part, Mr. Trump is defending himself against impeachment and emphasizing trade deals and a strong economy, often with a dose of hyperbole.
""With new trade deals, and more, THE BEST IS YET TO COME!"" he declared recently on Twitter.
Presidential historian Douglas Brinkley said that by year three the public has grown more accustomed to Mr. Trump's style.
""Since Trump's become president we've developed a rhythm of what to expect. Somebody's going to criticize the president, he's going to fight back on Twitter. I don't think it's a grab bag full of surprises any more; it's Trump being Trump,"" said Mr. Brinkley, a professor at Rice University.
Though his year ended with impeachment, Mr. Trump also closed out 2019 with a
phase one trade deal
with China and won legislative support for his replacement of the North American Free Trade Agreement as well as funding for a U.S. Space Force.
""I think he's in a better position than most people expected three years ago,"" said Republican strategist Alex Conant, who worked for Sen. Marco Rubio's 2016 presidential campaign. ""Between the economy and some legislative victories, he has some tailwinds.""
Democrats played down Mr. Trump's 2019 policy wins and said they were prepared to take him on in 2020. They pointed to his
slumping support in suburbs
and their own strong turnout in the 2018 midterms and in some 2019 races as evidence of momentum.
""We are taking nothing for granted,"" said Democratic National Committee spokesman David Bergstein. ""We know that each of these battleground races are going to be tight, and we are preparing to win them no matter who our eventual nominee is.""
SHARE YOUR THOUGHTS
How would you grade President Trump's performance last year? Join the conversation below.
While Mr. Trump's backers point to his policy wins and the impeachment process as energizing their voters, Democrats also stress that his presidency has galvanized their supporters as well, both through frustration with his policies on issues like immigration and the environment, as well as his confrontational personal style.
""I believe his actions and his rhetoric are so divisive that he's going to turn out Democrats in record numbers,"" said Democratic strategist Jim Manley.
Polling underscored the divided feelings about Mr. Trump throughout the nation. A recent Wall Street Journal/NBC News poll found that 48% of registered voters said they would vote against Mr. Trump, no matter who the Democrats choose as their nominee. By contrast, 34% of registered voters surveyed said they were certain to vote to re-elect the president. That poll also showed the president's approval rating at 44%, with 54% disapproving.
While he saw some successes in 2019, impeachment also leaves a lasting stain on Mr. Trump's legacy. He is accused of pressuring Ukraine's president this summer to announce investigations that would benefit Mr. Trump politically, and making $391 million in U.S. security aid contingent on Kyiv going public with investigations. The House resolution says he released the aid after his efforts were known, but then blocked officials from testifying in the probe.
Mr. Trump denies any wrongdoing, and the White House has said it is protecting executive branch authority by not allowing officials to testify. But Democrats argue that he abused his executive power and that impeachment was a responsibility.
Related
*
Trump Says He Will Sign Trade Deal With China on Jan. 15
(Dec. 31, 2019)
*
Bolton Criticizes Trump Over Moves on North Korea
(Dec. 23, 2019)
*
McConnell, Schumer Lay Out Dueling Visions for Senate Impeachment Trial
(Dec. 23, 2019)
*
Capital Journal: The Downsides of Trump's Slashing Style Are Showing
(Dec. 23, 2019)
Despite their differences, the White House and Democratic House members came together to reach many of the recent bipartisan deals. While the deals benefit the president, they will also prove helpful to vulnerable Democrats heading into the campaign year.
Despite gloomy predictions at the start of the year about prospects for an economic downturn—and ripples of anxiety amid the extended trade clash with China—Mr. Trump ended the year on solid economic footing, bolstered by
strong jobs numbers
and rising wages. Heading into 2020, his phase one trade deal with China has soothed investors, who grew jittery during the president's aggressive negotiating.
During 2019, the president also continued a foreign policy with a focus on preserving military might while often showing caution on engagement. He sought to withdraw U.S. troops from northern Syria,
drawing criticism
from many in his party. He also
called off a planned military strike
against Iran over the downing of an unmanned U.S. surveillance drone, concerned it was an overreaction.
A key achievement for Mr. Trump was the
U.S.-led raid
that resulted in the death of Islamic State leader Abu Bakr al-Baghdadi, considered a significant setback for the militant group. The president has emphasized that mission on the campaign trail.
Mr. Trump's other first-term policy wins include exiting the Iran nuclear deal, confirming conservative judges and cutting taxes. But his efforts to build a wall along the U.S.-Mexico border have lagged behind, he hasn't repealed former President Obama's health-care law, and he has achieved only a phase one trade deal with China.
Looking ahead, Mr. Trump faces unknowns as he aims to become the first president to seek re-election after being impeached. The process has yet to run its course in the Senate, though the Republican-led chamber is expected to acquit him. The tax returns he has long sought to keep private could come to light next year, depending on a Supreme Court ruling. And just who his Democratic opponent will be might not be clear for some time.
The president's re-election campaign team said they were ready for any surprises, with spokesman Tim Murtaugh stressing their fundraising and organizing efforts and saying Mr. Trump is used to weathering crises.
""People act as if this president hasn't been under fire since even before he became the nominee,"" Mr. Murtaugh said.
Mr. Trump seemed to acknowledge that the kind of churn that has defined his first three years would continue between now and Election Day.
""In the life of Trump,"" he said at a recent rally in Michigan, ""10 months is an eternity.""
Capital Journal In Your Inbox
Get the latest scoops, analysis and insights driving Washington from the WSJ's D.C. bureau, with Capital Journal.
Sign up.

Write to Catherine Lucey at
catherine.lucey@wsj.com

Credit: By Catherine Lucey Word count: 1304Show lessYou have requested ""on-the-fly"" machine translation of selected content from our databases. This functionality is provided solely for your convenience and is in no way intended to replace human translation. Show full disclaimerNeither ProQuest nor its licensors make any representations or warranties with respect to the translations. The translations are automatically generated ""AS IS"" and ""AS AVAILABLE"" and are not retained in our systems. PROQUEST AND ITS LICENSORS SPECIFICALLY DISCLAIM ANY AND ALL EXPRESS OR IMPLIED WARRANTIES, INCLUDING WITHOUT LIMITATION, ANY WARRANTIES FOR AVAILABILITY, ACCURACY, TIMELINESS, COMPLETENESS, NON-INFRINGMENT, MERCHANTABILITY OR FITNESS FOR A PARTICULAR PURPOSE. Your use of the translations is subject to all use restrictions contained in your Electronic Products License Agreement and by using the translation functionality you agree to forgo any and all claims against ProQuest or its licensors for your use of the translation functionality and any output derived there from. Hide full disclaimer

Longer documents can take a while to translate. Rather than keep you waiting, we have only translated the first few paragraphs. Click the button below if you want to translate the rest of the document.
Translate AllCopyright 2020 Dow Jones & Company, Inc. All Rights Reserved.","Wall Street Journal (Online)","1304"
"1585369844-709","https://search-proquest-com.proxygw.wrlc.org/results/F74DC863F010412CPQ/1?accountid=11243","Full text","https://search-proquest-com.proxygw.wrlc.org/docview/2351515696/fulltext/F74DC863F010412CPQ/52?accountid=11243","Trump Denounces Impeachment, Saying He 'Went Through Hell'; President calls top Democrats 'very evil and sick people' a day after Republican-led Senate acquitted him","Hide highlightingFull TextTranslateUndo Translation FromToTranslateTranslation in progress... 

[[missing key: loadingAnimation]]The full text may take 40-120 seconds to translate; larger documents may take longer.

Cancel
OverlayEndTurn on search term navigationTurn on search term navigation
| Jump to first hit
WASHINGTON—Taking a victory lap a day after
he was acquitted
in the Senate impeachment trial, President Trump said he ""went through hell"" during what he deemed a politically driven investigation and called top Democrats ""very evil and sick people"" for seeking his removal from office.
Before an audience of aides and Republican allies, Mr. Trump offered freewheeling remarks from the East Room of the White House Thursday. Speaking for just over an hour, he characterized the event as a celebration, while taking swings at political rivals who he alleged have been targeting him since he took office.
""We've been going through this now for over three years. It was evil, it was corrupt, it was dirty cops, it was leakers and liars, and this should never, ever happen to another president, ever,"" Mr. Trump said.
Holding up a copy of a newspaper with the headline ""Trump Acquitted,"" he quipped: ""It's the only good headline I've had in the Washington Post.""
He reiterated his stance that he did nothing improper regarding Ukraine, and called former special counsel
Robert Mueller's earlier probe
into possible ties between his 2016 campaign and Russia ""all bullshit.""
The remarks came one day after the Republican-led Senate acquitted Mr. Trump on
two articles of impeachment
stemming from his efforts to
press Ukraine
to announce investigations that would benefit him politically in this year's election, including a probe of former Vice President Joe Biden, a Democratic presidential candidate.
Mr. Trump's comments about Democratic leaders also came on the heels of his
State of the Union speech
on Tuesday night, when he didn't shake the hand offered by House Speaker Nancy Pelosi (D., Calif.), and she ripped up her copy of his address at its conclusion.
""He is impeached forever, no matter what he says or the headlines he wanted to carry around,"" Mrs. Pelosi said in remarks to reporters on Thursday. She added that Mr. Trump was ""never getting rid of that scar.""
Mrs. Pelosi also defended tearing up the speech, calling the address ""a manifesto of mistruths"" and her action necessary to ""get the attention of the American people.""
Related
*
Trump Acquitted on Both Articles

*
Capital Journal: Divide May Live On

*
President's Second-Term Agenda Still on the Drawing Board

The combative comments from Mr. Trump on Thursday and the vigorous response from Mrs. Pelosi made clear that the
rancorous political climate
between Democrats and Republicans will continue even with impeachment over.
Republicans cheered Mr. Trump's acquittal in the Senate and have called his impeachment part of a three-year effort to delegitimize the 2016 election and remove the president from office nine months before Democrats face him again at the ballot box.
Democrats said Mr. Trump's acquittal amounted to a defeat for the institution of Congress, and they warned that leaving Mr. Trump in office would free him to try to cheat in this year's election again.
In his White House event, the mood was triumphant, with guests hugging and slapping each other on the back. The crowd gave Mr. Trump more than a half-dozen standing ovations. He thanked various supporters in the room by name, including Senate Majority Leader Mitch McConnell (R., Ky.). Mr. Trump also thanked his Senate impeachment legal team.
He didn't mention personal attorney Rudy Giuliani, whose efforts in Ukraine have been at the center of the impeachment inquiry. Mr. Giuliani wasn't in attendance.
Mr. Trump also continued his criticism of Sen. Mitt Romney (R., Utah), who was the
lone Republican to vote to convict
the president on the first article of impeachment. Without naming him, Mr. Trump said there were ""some that used religion as a crutch"" and called him a failed presidential candidate.
Mr. Romney, the 2012 GOP candidate against President Obama, said Wednesday that he was a very religious person and reached an ""inescapable conviction that my oath before God demanded"" that he convict Mr. Trump.
Mr. Trump took two tacks toward Democrats in his White House speech. He called for bipartisanship, citing infrastructure and drug prices as areas of common interest. If Republicans and Democrats work together, ""what we can do is incredible,"" he said.
But he also continued to question the goodwill of Democrats. Earlier, in remarks at the National Prayer Breakfast, Mr. Trump appeared to reference Mrs. Pelosi, saying he doesn't like ""people who say, 'I pray for you,' when they know that's not so.""
Mrs. Pelosi, who was seated at a long table near the lectern at the breakfast, clapped as he entered the room. Later, she told reporters that she did pray for Mr. Trump, while criticizing his actions in office as ""so off the track of our Constitution, our values, our country.""
Mr. Trump's appearance at the breakfast marked the fourth year he has addressed the annual gathering, which is hosted by members of Congress and has been running since 1953. Presidents of both parties traditionally attend the event. Mr. Trump enjoys
strong support from evangelical Christians
, who were a key piece of his winning 2016 coalition.
Before Mr. Trump spoke at the breakfast, there was a keynote address from Arthur Brooks, former president of the American Enterprise Institute, who urged the audience to rise above the country's divided political climate.
Mr. Trump, known for his combative style, acknowledged the message when he took the podium, but said: ""Arthur, I don't know if I agree with you.""
Natalie Andrews contributed to this article.
Write to Catherine Lucey at
catherine.lucey@wsj.com
and Andrew Restuccia at
Andrew.Restuccia@wsj.com

Credit: By Catherine Lucey and Andrew Restuccia Word count: 921Show lessYou have requested ""on-the-fly"" machine translation of selected content from our databases. This functionality is provided solely for your convenience and is in no way intended to replace human translation. Show full disclaimerNeither ProQuest nor its licensors make any representations or warranties with respect to the translations. The translations are automatically generated ""AS IS"" and ""AS AVAILABLE"" and are not retained in our systems. PROQUEST AND ITS LICENSORS SPECIFICALLY DISCLAIM ANY AND ALL EXPRESS OR IMPLIED WARRANTIES, INCLUDING WITHOUT LIMITATION, ANY WARRANTIES FOR AVAILABILITY, ACCURACY, TIMELINESS, COMPLETENESS, NON-INFRINGMENT, MERCHANTABILITY OR FITNESS FOR A PARTICULAR PURPOSE. Your use of the translations is subject to all use restrictions contained in your Electronic Products License Agreement and by using the translation functionality you agree to forgo any and all claims against ProQuest or its licensors for your use of the translation functionality and any output derived there from. Hide full disclaimer

Longer documents can take a while to translate. Rather than keep you waiting, we have only translated the first few paragraphs. Click the button below if you want to translate the rest of the document.
Translate AllCopyright 2020 Dow Jones & Company, Inc. All Rights Reserved.","Wall Street Journal (Online)","921"
