web-scraper-order,web-scraper-start-url,link,link-href,title,text,media,word_count
"1585411167-870","https://search-proquest-com.proxygw.wrlc.org/results/DF8DD217BAB64E38PQ/1?accountid=11243","Full text","https://search-proquest-com.proxygw.wrlc.org/docview/2355472492/fulltext/DF8DD217BAB64E38PQ/11?accountid=11243","No, radical policies won't drive election-winning turnout","Hide highlightingFull TextTranslateUndo Translation FromToTranslateTranslation in progress... 

[[missing key: loadingAnimation]]The full text may take 40-120 seconds to translate; larger documents may take longer.

Cancel
OverlayEndTurn on search term navigationTurn on search term navigation
| Jump to first hit
A progressive call to arms may also summon the right, warns demographer

No myth is stronger in progressive circles than the magical, wonderworking powers of voter turnout. It's become a sort of pixie dust that you sprinkle over your strenuously progressive positions to ward off any suggestion that they might turn off voters. That is how Sen. Bernie Sanders (I-Vt.), now the Democratic presidential front-runner, has dealt with criticism that his more unpopular stances "" including eliminating private health insurance, decriminalizing the border and covering undocumented immigrants in a government health plan "" might cost him the votes he needs to beat President Trump. 
Sanders's explanation of why this is not a problem is simple, and he has repeated it endlessly. When a member of the Los Angeles Times editorial board asked him whether 'a candidate as far to the left as you' would 'alienate swing voters and moderates and independents,' the senator replied: 'The only way that you beat Trump is by having an unprecedented campaign, an unprecedentedly large voter turnout.' Faiz Shakir, Sanders's campaign manager, adds: 'Bernie Sanders has very unique appeal amongst [the younger] generation and can inspire, I think, a bunch of them to vote in percentages that they have never voted before.'
This has remarkably little empirical support. Take the 2018 midterm elections, in which the Democrats took back the House (a net 40-seat gain), carried the House popular vote by almost nine points and flipped seven Republican-held governorships. Turnout in that election was outstanding, topping 49-percent "" the highest midterm turnout since 1914 and up 13 points over the previous midterm, in 2014 "" and the demographic composition of the electorate came remarkably close to that of a presidential election year. (Typically, midterm voters tend to be much older and much whiter than those in presidential elections.) This was due both to fewer presidential 'drop-off' voters (people who voted in 2016 but not 2018) and to more midterm 'surge' voters (those who voted in 2018 but not 2016).
Nonetheless, the overwhelming majority of the Democrats' improved performance came not from fresh turnout of left-of-center voters, who typically skip midterms, but rather from people who cast votes in both elections "" yet switched from Republican in 2016 to Democratic in 2018. The data firm Catalist, whose numbers on 2018 are the best available, estimates that 89 percent of the Democrats' improved performance came from persuasion "" from vote-switchers "" not turnout. In its analysis, Catalist notes, 'If turnout was the only factor, then Democrats would not have seen nearly the gains that they ended up seeing … a big piece of Democratic victory was due to 2016 Trump voters turning around and voting for Democrats in 2018.'
Crucially, Democrats in 2018, especially the successful ones, did not run on particularly radical programs but rather on opposition to Trump himself, and to unpopular GOP actions on economic policy and health care (tax cuts for the rich and efforts to repeal Obamacare's protections, for example). In the end, the 2018 results do not support Sanders's theories "" not the central importance of high turnout, nor the supposed non-importance of changing mainstream voters' minds, nor the most effective issues to run on. 
Or take 2016. Many pundits, including Steve Phillips of Democracy in Color, have suggested that Hillary Clinton failed to inspire core Democratic voters "" notably African Americans "" and that a more progressive candidate would have done so (and won). 'The Democratic Party's fixation on pursuing those who voted for Mr. Trump is a fool's errand,' Phillips wrote. But an analysis using data from the States of Change project, sponsored by, among others, the Brookings Institution and the Center for American Progress, indicates that, even if black turnout in the 2016 election had matched that of 2012 (it dropped from 62 to 57 percent), Clinton would have still lost. On the other hand, if she had managed to reduce her losses among white noncollege voters by a mere one-quarter, she'd be president today. That's an issue of persuasion, not turnout.
What's more, States of Change data does not suggest that youth turnout, which Sanders promises to increase so significantly, was a particular Democratic problem in 2016. In fact, young voters (ages 18 to 29) increased their turnout more than any other age group in that election, from 42 percent in 2012 to 44-percent in 2016. They also increased "" if only slightly "" their margin of support for the Democratic candidate. In 2016, the age cohort that really killed Democrats was voters ages 45 to 64, who had split evenly in 2012 but leaned Republican by six percentage points four years later. Sanders's bouquet of unpopular positions hardly seems likely to help the Democrats make up ground among these voters.
But perhaps 2020 will be different if a Sanders candidacy can truly catalyze massive turnout. Then Democrats won't have to worry about persuading Obama-Trump voters or anyone else in the 'swing' category. Wrong! 
As Nate Cohn of the New York Times has noted after scrutinizing the data, it's a mistake to assume that Democrats would benefit disproportionately from high turnout. Trump is particularly strong among white noncollege voters, who dominate the pool of nonvoters in many areas of the country, including in key Rust Belt states. If the 2020 election indeed has historically high turnout, as many analysts expect, that spike could include many of these white noncollege voters in addition to Democratic-leaning constituencies such as nonwhites and young voters. The result could be an increase in Democrats' popular-vote total "" and another loss in the electoral college.
This analysis shreds an implicit assumption of Sanders and other members of the turnout-will-solve-everything crowd: that if they polarize the election by highlighting progressive issues, 'their' nonvoters will show up at the polls, but none of the nonvoters from the other side will. That view is also contradicted by many political science studies. Stanford political scientists Andrew Hall and Daniel Thompson, for example, studied House races between 2006 and 2014 and found that highly ideological candidates who beat moderates for a party nomination indeed increased turnout in their own party in the general election "" but they increased the opposition turnout even more. (The difference was between three and eight percentage points.) Apparently, their extreme political stances did more to turn out the other side to vote against them than to turn out their own side to vote for them.
The turnout equation does not necessarily return positive results for a candidate like Sanders. The reverse is more likely. It is truly magical thinking to believe that, in a highly polarized situation, only your side gets to increase turnout. And if the other side turns out in droves, you might not like the results "" a warning Democrats would be wise to heed.-

theoptimisticleftist.com



, a senior fellow at the Center for American Progress Action Fund, is the author of 'The Optimistic Leftist: Why the 21st Century Will Be Better Than You Think.'
Word count: 1166Show lessYou have requested ""on-the-fly"" machine translation of selected content from our databases. This functionality is provided solely for your convenience and is in no way intended to replace human translation. Show full disclaimerNeither ProQuest nor its licensors make any representations or warranties with respect to the translations. The translations are automatically generated ""AS IS"" and ""AS AVAILABLE"" and are not retained in our systems. PROQUEST AND ITS LICENSORS SPECIFICALLY DISCLAIM ANY AND ALL EXPRESS OR IMPLIED WARRANTIES, INCLUDING WITHOUT LIMITATION, ANY WARRANTIES FOR AVAILABILITY, ACCURACY, TIMELINESS, COMPLETENESS, NON-INFRINGMENT, MERCHANTABILITY OR FITNESS FOR A PARTICULAR PURPOSE. Your use of the translations is subject to all use restrictions contained in your Electronic Products License Agreement and by using the translation functionality you agree to forgo any and all claims against ProQuest or its licensors for your use of the translation functionality and any output derived there from. Hide full disclaimer

Longer documents can take a while to translate. Rather than keep you waiting, we have only translated the first few paragraphs. Click the button below if you want to translate the rest of the document.
Translate AllCopyright WP Company LLC d/b/a The Washington Post Feb 16, 2020","The Washington Post","1166"
"1585411022-861","https://search-proquest-com.proxygw.wrlc.org/results/DF8DD217BAB64E38PQ/1?accountid=11243","Full text","https://search-proquest-com.proxygw.wrlc.org/docview/2366003146/fulltext/DF8DD217BAB64E38PQ/20?accountid=11243","Moderate Democrats still seeking Super Tuesday inspiration","Hide highlightingFull TextTranslateUndo Translation FromToTranslateTranslation in progress... 

[[missing key: loadingAnimation]]The full text may take 40-120 seconds to translate; larger documents may take longer.

Cancel
OverlayEndTurn on search term navigationTurn on search term navigation
| Jump to first hit
N.Va. voters are wary of Sanders but lukewarm on the alternatives

The meeting at the pub resembled a group-therapy session, with participants "" a town mayor, a former school board member and about 15 other moderate Democrats "" sharing anxiety over Tuesday's presidential primary election in Virginia.
They all wanted to know: How is it possible that Sen. Bernie Sanders (I-Vt.) might win the party's presidential nomination? And why weren't they excited about any of the other candidates?
'I don't get it,' Ron Goodes, 74, said to the others at the SideBar pub in Leesburg, referring to how the primary elections have gone so far. 'I don't get why there's such disarray, why there's sniping, why there is less focus on 'what I can do' as opposed to 'how lousy that other person is.' It's just a freaking mess.'
'I can't vote for Bernie,' said Sara Gallagher, 69. 'He's just too left for me.'
In the affluent Northern Virginia suburbs that will be ground zero for Democratic turnout in November, an 'anybody but Bernie' movement is struggling to take hold.
Moderate Virginia voters have turned out in droves for Democratic candidates since the election of Donald Trump in 2016, powering the party's takeover of the U.S. House, both chambers of the state legislature and county boards in booming suburbs such as Prince William and Loudoun counties.
Now, those same voters are bouncing between presidential candidates, hoping that someone "" anyone "" can generate enough excitement to foil a November matchup between Sanders and Trump that they believe would be disastrous.
Some see Sanders as a divisive populist who will turn off independents and moderate Republicans who are crucial in swing states such as Pennsylvania or Michigan. Others, averse to the democratic socialist's calls for Medicare-for-all and free college tuition, say they could stay home on Election Day if Sanders is the nominee.
After canvassing for and donating to Democrats at the state and local level, they are ambivalent, at best, about billionaire Mike Bloomberg, former vice president Joe Biden, ex-South Bend, Ind., mayor Pete Buttigieg and Sens. Elizabeth Warren of Massachusetts and Amy Klobuchar of Minnesota. Their uncertainty was reflected in a Monmouth University poll last month that showed just 1 in 4 Democratic voters in Virginia were sure about whom they prefer "" and that those who back Sanders, as opposed to the rest of the field, were enthusiastic about their choice.
'Moderates are very conflicted about the strengths of candidates in their lane,' said Quentin Kidd, director of Christopher Newport University's Wason Center for Public Policy. 'There's just not a candidate who is as exciting or energetic as, oddly enough, 78-year-old Bernie Sanders is.'
Virginia's long history of across-the-aisle politics makes the state seemingly fertile ground for a presidential candidate who hovers closer to the center than Sanders. In 2016, Democrats in the state chose Hillary Clinton over Sanders nearly 2 to 1.

Yet, with establishment Democratic officials aligning themselves with different moderates "" or not endorsing at all "" Sanders appears poised to take a sizable portion of Virginia's 99 delegates into what is shaping up to potentially be the first seriously contested Democratic Party convention in 52 years.
The same Monmouth University poll showed him locked in a tie at the top of the field with Bloomberg, the former New York mayor who will appear on the ballot for the first time in the 14 Super Tuesday states and has saturated Virginia with campaign ads. Biden and Buttigieg were second and third, respectively.
But while Sanders has since gone on to decisively win the Nevada caucuses, Bloomberg has faced withering attacks on the debate stage over alleged mistreatment of women in his media company and a stop-and-frisk policy during his mayoral term that targeted African Americans and Latinos.
An accompanying tide of uncertainty has rolled through Democratic social media chat groups, debate watch parties and even candidate rallies in Northern Virginia.
Outside a Warren rally in Arlington on Feb. 13, Marguerite Metzler said that 'it's disturbing' to think of Bloomberg, a former Republican, as the only viable alternative to Sanders, whose 'building-the-base strategy' she compared to Trump's.
Though she believes Warren could be an effective president, Metzler, 69, said the senator may have blown her chances of winning in Virginia.
'There are people who like her but haven't liked some of her ideas,' she said. 'And I think she squandered that by building such a strong association with free college and Medicare-for-all.'
After ticking off a list of misgivings over the other Democratic candidates "" Biden lacks energy, Buttigieg is inexperienced "" Metzler, who lives in Springfield, landed on a possible choice: 'Maybe Amy?'

Sanders's supporters don't understand the confusion.
During a recent debate watch party in Fairfax City, Amber Beichler and Isabelle Oldfield happily cheered as Warren and the other candidates laid into Bloomberg, while Sanders emerged relatively unscathed.
Both argued that the senator from Vermont is the only one who can inspire enough passion among Democrats to defeat Trump. They cited the support he has received so far from white, Latino and African American voters worried about climate change, rising health-care costs and stagnant wages in an otherwise robust economy "" all of which Sanders has vowed to fix.
'It'll be that inspiring platform that will get people off the couch and into the voting booth,' said Beichler, 29, of Herndon.
Added Oldfield, 24, who lives in Reston, 'He's actually the perfect candidate to run against Trump, because you need a populist to win against a populist.'
Nearby, Mike Miner, 35, who supports Warren and is also from Reston, was philosophical about why Democrats are anxious about Sanders and unsure about who else should take on the president.
'When you talk to people, their number one issue is defeating Donald Trump,' Miner said. 'You cannot run this experiment multiple times and see which candidate does better, which one does a little bit worse. You're going off your gut. And that's why you're seeing such huge fluctuations in polls and support rising and falling.'
At a Buttigieg rally in Arlington this past weekend, Joseph Brecht, 21, advertised himself as the kind of voter Democrats yearn to win over. The George Mason University student held up a 'Republicans for Pete' sign that drew cheers from anyone who saw it, saying he voted for Trump in 2016 but is now disillusioned.
'I consider myself a moderate Republican, but I'm not a socialist,' Brecht said, referring to Sanders. In November, 'I'm going to try to support the Democratic nominee, but if it's someone I really can't stand, I'm just not going to vote for that office.'
Jill Weiss, 49, showed up to the rally wearing a red Moms Demand Action T-shirt. The group is an offshoot of the Everytown for Gun Safety group funded by Bloomberg that was instrumental in helping Democrats seize control of the General Assembly in the fall.
'It doesn't mean I support Bloomberg,' Weiss, of Leesburg, quickly said. She is leaning toward Biden because of his foreign policy experience but is also open to Buttigieg and Klobuchar. Reflecting on the possibility of a Sanders nomination, Weiss added: 'I always thought I was a liberal Democrat. But everything has shifted.'

Inside the Leesburg pub, the group attending the event organized by the Loudoun County Democratic Committee expressed frustration with that shifting terrain.
The suburb was key in Democratic victories in the fall in the statehouse and on the Loudoun County Board of Supervisors. In 2018, Loudoun also propelled Democrat Jennifer Wexton to victory over GOP incumbent Barbara Comstock, helping to fuel a new Democratic House majority.
Yet that afternoon, there were the formerly energized voters, wearing 'Hello my name is . . .' tags and openly worrying about not having a significant voice in what they see as the mother of all elections.
'I'm seriously contemplating not voting on March 3, which, for me, is really weird,' said Charlotte McConnell, 40. 'I feel like I'm in the Twilight Zone.'
Gallagher, who said she is vehemently opposed to Sanders, said she will probably not cast a ballot in November if he gets the nomination. Jessica Puentes, 31, said she will probably stay home if Bloomberg is the Democratic nominee.

Tony Fasolo, 82, lamented the strain that Sanders's 2016 presidential run had on his relationship with his son, who backed Sanders over Clinton and still 'doesn't talk to me too much.'
Kelly Burke, the Leesburg mayor, said that without a candidate who has the same kind of gravitational pull that Sanders has, many moderates feel stuck.
'We all realize what's at stake, in that this election matters probably like no election in the life of this country, and that's why we're struggling,' she said. 'We don't want to make a mistake.'

antonio.olivo@washpost.com

Word count: 1466Show lessYou have requested ""on-the-fly"" machine translation of selected content from our databases. This functionality is provided solely for your convenience and is in no way intended to replace human translation. Show full disclaimerNeither ProQuest nor its licensors make any representations or warranties with respect to the translations. The translations are automatically generated ""AS IS"" and ""AS AVAILABLE"" and are not retained in our systems. PROQUEST AND ITS LICENSORS SPECIFICALLY DISCLAIM ANY AND ALL EXPRESS OR IMPLIED WARRANTIES, INCLUDING WITHOUT LIMITATION, ANY WARRANTIES FOR AVAILABILITY, ACCURACY, TIMELINESS, COMPLETENESS, NON-INFRINGMENT, MERCHANTABILITY OR FITNESS FOR A PARTICULAR PURPOSE. Your use of the translations is subject to all use restrictions contained in your Electronic Products License Agreement and by using the translation functionality you agree to forgo any and all claims against ProQuest or its licensors for your use of the translation functionality and any output derived there from. Hide full disclaimer

Longer documents can take a while to translate. Rather than keep you waiting, we have only translated the first few paragraphs. Click the button below if you want to translate the rest of the document.
Translate AllCopyright WP Company LLC d/b/a The Washington Post Feb 28, 2020","The Washington Post","1466"
