web-scraper-order,web-scraper-start-url,link,link-href,title,text,media,word_count
"1585411327-880","https://search-proquest-com.proxygw.wrlc.org/results/DF8DD217BAB64E38PQ/1?accountid=11243","Full text","https://search-proquest-com.proxygw.wrlc.org/docview/2336840525/fulltext/DF8DD217BAB64E38PQ/1?accountid=11243","Trump, allies turn sights on Sanders amid polling jump","Hide highlightingFull TextTranslateUndo Translation FromToTranslateTranslation in progress... 

[[missing key: loadingAnimation]]The full text may take 40-120 seconds to translate; larger documents may take longer.

Cancel
OverlayEndTurn on search term navigationTurn on search term navigation
| Jump to first hit
Coordinated attacks come as Democratic rival blasts handling of Iran
President Trump and his campaign have launched their most sustained attacks yet on Democratic presidential candidate Bernie Sanders, highlighting the Vermont senator's rising poll numbers and sharp criticism of the White House's handling of tensions with Iran.
In a coordinated string of press statements, Twitter posts and televised digs over the past week, Trump and his allies have trained their sights on Sanders, seeking to tarnish his foreign policy credentials and commander in chief appeal. The attacks represent a shift for Trump, who had previously devoted more of his energy to criticizing former vice president Joe Biden. 
Trump's allies say the president drives the campaign's political strategy, acknowledging that he is an avid consumer of the public polling and the cable-TV punditry that has documented Sanders's growing strength in the Democratic presidential primary. 
Trump mentioned Sanders by name 10 times during his rally last week in Ohio "" more than any other candidate. He continued the attacks on Twitter over the weekend and on Monday, singling Sanders out for more direct criticism than other Democratic contenders.
'Wow! Crazy Bernie Sanders is surging in the polls, looking very good against his opponents in the Do Nothing Party,' Trump wrote Sunday on Twitter. 'So what does this all mean? Stay tuned!'
Sanders, who has pilloried Trump for authorizing the drone strike that killed Iranian Maj. Gen. Qasem Soleimani, had a curt response: 'It means you're going to lose.'
Trump's campaign has released three statements in the last week specifically attacking Sanders on foreign policy, a significant escalation that has been mirrored by top Twitter accounts managed by campaign aides.
On Monday, the campaign accused Sanders of defending 'the world's top terrorist' and 'pushing a naive, dangerous policy of appeasement toward Iran.' Other aides attacked Sanders on issues ranging from student loans to human rights.
Tim Murtaugh, a Trump campaign spokesman, said the focus on Sanders is not a sign of fear of the Vermont senator or any other candidate, arguing that 'Trump would beat any of them handily.'
'Over the last year, the campaign has engaged various Democrats when the opportunities have presented themselves,' Murtaugh said. 'In Sanders's case, his surge in the polls coincided with his emergence as the chief apologist for the Iranian regime. We needed to point out that he would be dangerous as president since he made clear he would appease terrorists and terror-sponsoring nations.'
Sanders, who has been staunchly opposed to America's entanglements in the Middle East, has used the conflict with Iran to draw a contrast both with Trump and with his Democratic rivals. He has accused Trump of abandoning his 2016 pledge to extract the U.S. from costly wars and has made a direct appeal to Trump voters who are disillusioned by the president's performance in office. 
'Bernie, who has spent his entire life standing with the working class, is going to spend every moment of the general election reminding working Americans that Trump was lying when he said he would stand with them and that he would end the endless wars,' said Mike Casca, the Sanders campaign communications director. 'He's the most corrupt president in American history, and Bernie Sanders is going to sweep him out of the White House.'
Earlier this month, Sanders introduced legislation to block funding for military conflict with Iran, something he said would be 'disastrous.'
'At a time when we face the urgent need to rebuild our crumbling infrastructure, to build the housing we desperately need, and to address the existential crisis of climate change, we as a nation, must get our priorities right,' he said in a joint statement with Rep. Ro Khanna (D-Calif.).
Sanders has seen his poll numbers rise and his fundraising improve as he has campaigned on bringing about a 'revolution' capable of ousting Trump from office. A poll released Friday by the Des Moines Register and CNN showed Sanders narrowly leading a close race in Iowa just three weeks before the Feb. 3 caucuses there. The survey is the first to have Sanders leading in the state, and it showed that he enjoys support from 20 percent of likely voters.
Sanders raised $34.5 million in the fourth quarter of 2019, a massive sum fueled by his online fundraising machine that bested all Democratic contenders. 
Some Trump allies have described Sanders's fundraising as an impressive sign of his potential staying power in the Democratic primary. 
And while most of the Trump campaign's recent attacks on Sanders have focused on foreign policy, the president's surrogates have ramped up their critiques of his domestic agenda as well. Aides said they expect the onslaught against Sanders to continue and intensify, as Trump uses the liberal senator as a stand-in for the entire field of Democrats. 
Trump is scheduled to hold a rally today in Wisconsin, a state where Sanders has said his appeal to working-class voters could put him in a strong position to defeat Trump. Last year, Sanders embarked on a 'Bernie Beats Trump' tour to highlight his strength against the president in key states.
'FACT: Bernie Sanders Is A Wealthy, Fossil Fuel-Guzzling Millionaire,' read one statement from the Trump campaign on Thursday, a day after the campaign released a statement saying he 'Can't Be Trusted To Defend American Lives.'
Sanders has cast doubt on the Trump administration's shifting explanations for the strike that killed Soleimani, accusing the president of concocting a reason to conduct an 'assassination' of a foreign official.
'The difficulty that we have, and I don't mean to be rude here, is we have a president that's a pathological liar,' he said Friday on NBC's TODAY show. 
Trump's campaign has responded by trying to brand the senator as soft on terrorism, a scorched-earth tactic that has come to define the strategy of the president's reelection bid. 
'How many American children have to be left fatherless before Bernie Sanders will defend American lives?' Trump's campaign manager Brad Parscale tweeted Sunday.
Some of Trump's advisers say they are spoiling for a general election fight with Sanders, describing him as a 'socialist' who turns off moderate voters. 
'I'd rather face Bernie versus Biden,' said Bryan Lanza, who advised Trump's 2016 campaign and transition. 'Let's have the real contrast of who these parties are. Let's have the real debate.'
Trump appeared to egg on a battle between Sanders and Sen. Elizabeth Warren (D-Mass.) on Monday, tweeting that the two liberals are fighting over voters. He also turned his fire on former New York mayor Mike Bloomberg, who has been running ads targeting Trump on health care and other issues. 
'Bernie Sander's volunteers are trashing Elizabeth 'Pocahontus' Warren. Everybody knows her campaign is dead and want her potential voters,' he wrote, misspelling the slur he regularly uses against Warren. 'Mini Mike B is also trying, but getting tiny crowds which are all leaving fast. Elizabeth is very angry at Bernie. Do I see a feud brewing?'

toluse.olorunnipa@washpost.com

Word count: 1159Show lessYou have requested ""on-the-fly"" machine translation of selected content from our databases. This functionality is provided solely for your convenience and is in no way intended to replace human translation. Show full disclaimerNeither ProQuest nor its licensors make any representations or warranties with respect to the translations. The translations are automatically generated ""AS IS"" and ""AS AVAILABLE"" and are not retained in our systems. PROQUEST AND ITS LICENSORS SPECIFICALLY DISCLAIM ANY AND ALL EXPRESS OR IMPLIED WARRANTIES, INCLUDING WITHOUT LIMITATION, ANY WARRANTIES FOR AVAILABILITY, ACCURACY, TIMELINESS, COMPLETENESS, NON-INFRINGMENT, MERCHANTABILITY OR FITNESS FOR A PARTICULAR PURPOSE. Your use of the translations is subject to all use restrictions contained in your Electronic Products License Agreement and by using the translation functionality you agree to forgo any and all claims against ProQuest or its licensors for your use of the translation functionality and any output derived there from. Hide full disclaimer

Longer documents can take a while to translate. Rather than keep you waiting, we have only translated the first few paragraphs. Click the button below if you want to translate the rest of the document.
Translate AllCopyright WP Company LLC d/b/a The Washington Post Jan 14, 2020","The Washington Post","1159"
"1585411215-873","https://search-proquest-com.proxygw.wrlc.org/results/DF8DD217BAB64E38PQ/1?accountid=11243","Full text","https://search-proquest-com.proxygw.wrlc.org/docview/2338880250/fulltext/DF8DD217BAB64E38PQ/8?accountid=11243","Sexism question doesn't have a breezy answer","Hide highlightingFull TextTranslateUndo Translation FromToTranslateTranslation in progress... 

[[missing key: loadingAnimation]]The full text may take 40-120 seconds to translate; larger documents may take longer.

Cancel
OverlayEndTurn on search term navigationTurn on search term navigation
| Jump to first hit

Elizabeth Warren's biggest applause line at Tuesday night's Democratic debate had all the road-tested messaging appeal of a pink-pussyhatted women's march. Gesturing to the male candidates on the stage, she whipped out some math: 'Collectively [the men] have lost 10 elections. The only people who have won every election . . . are the women!' 
The audience ate it up. The future is female! Nasty women! Nevertheless she persisted, and so did Amy Klobuchar!

Surely the moment was planned. Memorizing each of your opponents' loss records could be read as petty, but it got the job done. It dispensed with the sexism question the way we like to see the sexism question dispensed with onstage: breezily, and with a girl-power flourish.
Many female candidates have a go-to line, something capable and Annie Oakleyish that they can pull out for such an occasion; Klobuchar likes to say that of course a woman can beat Donald Trump, 'Nancy Pelosi does it every day.' What else are the candidates supposed to do? In debate after debate, moderators wedge sexism somewhere between Medicare-for-all and the Iran nuclear deal, then set their timers. I
n 45 seconds or less: Is America ready for a female president?
As if that question could be answered in 45 seconds, or 75 seconds. As if we haven't been trying to answer it for years.
The hook this time around was a Rashomon-like conversation that took place between Warren and Bernie Sanders more than a year ago as both were considering White House runs, and which CNN had revealed on Monday. Warren says Sanders told her that a woman couldn't win in 2020, and 'I disagreed.'
In the debate, Sanders denied he'd ever said such a thing, highlighting his track record for supporting female politicians, including Warren herself. Earlier that day, his campaign had outlined his version of the conversation in a statement: 'What I did say that night was that Donald Trump is a sexist, a racist and a liar who would weaponize whatever he could.' 
Pundits had 


teed this up as a conflict, as if one of the candidates were lying. In 45 seconds or less: how quickly can
 you throw your longtime friend and colleague under the bus?

It's entirely possible that both of them were telling the truth, though. It's possible Sanders believed he was merely warning Warren that the race would be even harder for her, and it's possible Warren believed he was saying something more forceful: that President Trump's skill with weaponizing misogyny made Sanders doubt a female candidate's viability.
It's possible we still prefer our discussions of sexism in politics to be peppy, upbeat one-liners, because the alternative is for them to be messy rehashings of 'whether a woman can be president.' That question isn't ever about the woman but about her potential voters and the moral fantasies we spin about ourselves.

Presumably, whatever Bernie Sanders said or didn't say, he wasn't trying to imply that a woman wasn't good enough to win "" which would be a judgment about women "" but rather that any woman running for president would face a country that wasn't good enough to vote for her. Which is a judgment about society.
In that case, Sanders wasn't saying anything that worried Democrats, including many women, haven't said for months "" the 'electability' argument via which hordes of voters apparently plan to vote for Joe Biden not because they like Joe Biden but because they think their neighbors do. That argument says: I'm not sexist, but in order to defeat Donald Trump, we have to live in the real world, which is.
That argument is reasonable, sort of. If your primary goal is putting out a fire, then your instinct is to hand the hose to the firefighter wearing the most flame-retardant gear. In this case: the candidate protected by his age, sexual orientation and XY chromosomes. That argument is also utterly exhausting. Because it's also saying: I'm not sexist, but my position is that we should capitulate to the sexists by nominating only male candidates until the problem miraculously fixes itself. I'm not sexist, but rather than trying to make the world better, I think we should meet the world where it is, which is to say, in hell.
When is someone acknowledging sexism, and when is someone just being sexist?
That's actually the conversation that should have happened on the debate stage. 
Not Elizabeth Warren firing up a women-take-care-of-business sound bite, but Elizabeth Warren admitting that, yeah, it's actually heartbreaking to have even your good friends tell you that the country won't believe in you enough to vote for you. Yeah, you worry that if you lose, people are going to say it's because you're a woman, and the loss will unfairly impact female candidates for years to come.
Not Bernie Sanders denying that he'd ever even thought such a thing but Bernie Sanders admitting that of course he'd thought such a thing, just like many voters had. He worried that the country would eviscerate a female candidate, as had happened many times before, and he was trying to balance that fear against his very real desire for gender equality in politics.
Not two candidates trying to convince the country that it isn't sexist "" Look at how many times you've voted for ladies! "" but two candidates talking frankly about sexism and our fears surrounding it. 
That's what America needs if it's going to stop enacting the same hackneyed psychodrama over and over. Something like: The only sexism we have to fear is the fear of sexism itself.
Which might be too clunky to work as a rah-rah T-shirt slogan, but it does fit into 45 seconds.

monica.hesse@washpost.com

Monica Hesse is a columnist writing about gender and its impact on society. For more visit wapo.st/hesse.
Word count: 971Show lessYou have requested ""on-the-fly"" machine translation of selected content from our databases. This functionality is provided solely for your convenience and is in no way intended to replace human translation. Show full disclaimerNeither ProQuest nor its licensors make any representations or warranties with respect to the translations. The translations are automatically generated ""AS IS"" and ""AS AVAILABLE"" and are not retained in our systems. PROQUEST AND ITS LICENSORS SPECIFICALLY DISCLAIM ANY AND ALL EXPRESS OR IMPLIED WARRANTIES, INCLUDING WITHOUT LIMITATION, ANY WARRANTIES FOR AVAILABILITY, ACCURACY, TIMELINESS, COMPLETENESS, NON-INFRINGMENT, MERCHANTABILITY OR FITNESS FOR A PARTICULAR PURPOSE. Your use of the translations is subject to all use restrictions contained in your Electronic Products License Agreement and by using the translation functionality you agree to forgo any and all claims against ProQuest or its licensors for your use of the translation functionality and any output derived there from. Hide full disclaimer

Longer documents can take a while to translate. Rather than keep you waiting, we have only translated the first few paragraphs. Click the button below if you want to translate the rest of the document.
Translate AllCopyright WP Company LLC d/b/a The Washington Post Jan 16, 2020","The Washington Post","971"
